Source,Target,User,System,SegmentID,Segment,Score,Start,End,Delta
JPN,ENU,jpneng2510c,NHK_0425002735_AS12RSTFRORNtrg-rmt.en.txt,384,また，青方スペクトルと再加熱温度に対する制限を与え，それが４次元の標準的結果よりさらに強いことを示した。,77,2021-05-16 12:24:55.598000,2021-05-16 12:25:09.612000,0:00:14.014000
JPN,ENU,jpneng25124,NHK_0425002735_AS12RSTFRORNtrg-rmt.en.txt,385,カナダ北極群島のエルスメア島にあるアガシー氷帽で，１９９２年春，氷コアの掘削地点の決定や氷帽表面における不純物の取り込み過程などを調べるため予備調査を実施した。,100,2021-05-13 23:24:26.157000,2021-05-13 23:24:42.441000,0:00:16.284000
JPN,ENU,jpneng25140,NHK_0425002735_AS12RSTFRORNtrg-rmt.en.txt,386,調査は氷帽の頂上付近で２か所，やや下流域で１か所，合計３か所で深さ１．５ｍ程度のピットを掘り，その側面より連続的に積雪をサンプリングした。,26,2021-05-16 03:24:04.639000,2021-05-16 03:24:29.962000,0:00:25.323000
JPN,ENU,jpneng25107,NHK_0425002735_AS12RSTFRORNtrg-rmt.en.txt,387,分析の結果，アガシー氷帽での年間収支量が積雪にして４０ｃｍ程度であること，イオン主成分に明瞭な季節変化が認められることなどが判明した。,97,2021-05-15 07:07:45.973000,2021-05-15 07:07:53.505000,0:00:07.532000
JPN,ENU,jpneng25131,NHK_0425002735_AS12RSTFRORNtrg-rmt.en.txt,388,従って，同氷帽で採取するコアサンプルを分析・解析することによって過去の気候・環境変動史を解明することができると考えた［１９９３．３］,76,2021-05-14 17:31:59.930000,2021-05-14 17:32:13.313000,0:00:13.383000
JPN,ENU,jpneng25115,NHK_0425002735_AS12RSTFRORNtrg-rmt.en.txt,389,日本の地熱水研究開発は，昭和３０年代に始まった。,34,2021-05-19 05:54:21.622000,2021-05-19 05:54:36.439000,0:00:14.817000
JPN,ENU,jpneng2511d,NHK_0425002735_AS12RSTFRORNtrg-rmt.en.txt,390,今後のわが国のさく井業あるいは地下水ポンプ業界にとって，地熱水市場は大きなマーケットである。,54,2021-05-19 08:09:34.971000,2021-05-19 08:09:46.650000,0:00:11.679000
JPN,ENU,jpneng25104,NHK_0425002735_AS12RSTFRORNtrg-rmt.en.txt,391,しかし，温泉井の中にはメタン等の可燃性ガスを含むものがあって事故を引き起こしかねないので，注意が必要である。,82,2021-05-13 22:56:06.336000,2021-05-13 22:56:22.508000,0:00:16.172000
JPN,ENU,jpneng2512f,NHK_0425002735_AS12RSTFRORNtrg-rmt.en.txt,392,また，さく井にあたっては，地質学的に地層を分析し，無駄あるいは有害な井戸を掘らないようにしなければならない,72,2021-05-19 01:25:43.217000,2021-05-19 01:26:00.150000,0:00:16.933000
JPN,ENU,jpneng25139,NHK_0425002735_AS12RSTFRORNtrg-rmt.en.txt,393,有限要素法を用いた眼球の治療，手術シミュレーションについて研究を行った。,99,2021-05-15 19:12:04.994000,2021-05-15 19:12:14.993000,0:00:09.999000
JPN,ENU,jpneng25145,NHK_0425002735_AS12RSTFRORNtrg-rmt.en.txt,395,３次元内部構造顕微鏡を用いて，眼球の連続断面画像を入手した。,78,2021-05-17 05:21:00.532000,2021-05-17 05:21:09.974000,0:00:09.442000
JPN,ENU,jpneng25118,NHK_0425002735_AS12RSTFRORNtrg-rmt.en.txt,396,そのデータから，眼球組織のセグメント化を行い，個々のデータの数値化によりメッシュ作成を行った。,100,2021-05-13 22:19:04.666000,2021-05-13 22:19:14.199000,0:00:09.533000
JPN,ENU,jpneng2511e,NHK_0425002735_AS12RSTFRORNtrg-rmt.en.txt,397,メッシュ作成はマップドメッシュ法とボクセルメッシュ法を比較検討して，マップドメッシュ法を採用した。,2,2021-05-18 02:46:30.669000,2021-05-18 02:46:53.617000,0:00:22.948000
JPN,ENU,jpneng25113,NHK_0425002735_AS12RSTFRORNtrg-rmt.en.txt,398,結果，有限要素解析に適したメッシュ作成法を確立し，メッシュ上において眼球の各組織ごとにパート分けを行った眼球のメッシュを作成した。,68,2021-05-14 16:23:12.494000,2021-05-14 16:23:21.922000,0:00:09.428000
JPN,ENU,jpneng25124,NHK_0425002735_AS12RSTFRORNtrg-rmt.en.txt,399,塩分ストレスによる吸水の阻害や乾燥によって植物細胞の水分不足が起こると，それにより崩された細胞内外の浸透圧のバランスを回復するため，多くの植物は適合溶質と呼ばれる化合物を合成し，細胞内に蓄積する。,76,2021-05-13 23:18:32.295000,2021-05-13 23:18:35.773000,0:00:03.478000
JPN,ENU,jpneng25142,NHK_0425002735_AS12RSTFRORNtrg-rmt.en.txt,400,適合溶質としては，グリシンベタイン（ベタイン），プロリンなどの両性イオン，ピニトール，ソルビトール，マンニトールなどのポリオール類などが知られている。,100,2021-05-17 15:41:02.951000,2021-05-17 15:41:10.162000,0:00:07.211000
JPN,ENU,jpneng25144,NHK_0425002735_AS12RSTFRORNtrg-rmt.en.txt,401,遺伝子工学的手法を用いて，ベタイン合成遺伝子を持たない植物に，ベタイン合成遺伝子を導入することにより，植物の耐塩性を向上させることを目的とし，研究を進めた。,79,2021-05-16 23:19:57.435000,2021-05-16 23:20:04.999000,0:00:07.564000
JPN,ENU,jpneng2513f,NHK_0425002735_AS12RSTFRORNtrg-rmt.en.txt,402,１）ホウレンソウのベタイン合成遺伝子，２）マングローブのベタイン合成遺伝子，３）アラマンサスのベタイン合成遺伝子，４）大麦のＢＡＤＨ遺伝子で形質転換したイネの低温および高温耐性，５）マングローブのベタイントランスポーター，につき概説した。,33,2021-05-17 10:16:48.657000,2021-05-17 10:17:16.077000,0:00:27.420000
JPN,ENU,jpneng2513e,NHK_0425002735_AS12RSTFRORNtrg-rmt.en.txt,403,肝臓における鉄蓄積機構について鉄過剰症候群と対比して述べ，さらに除鉄療法の最近の知見を概説した。,69,2021-05-17 12:41:40.375000,2021-05-17 12:41:49.267000,0:00:08.892000
JPN,ENU,jpneng25105,NHK_0425002735_AS12RSTFRORNtrg-rmt.en.txt,404,肝実質細胞における鉄取り込みは，鉄制御蛋白質（ＩＲＰ）システムによるＴｆＲ，ＤＭＴ‐１，フェリチン，ＦＰ‐１の発現制御やＨＦＥによるＴｆＲ機能の負の制御によって調節されている。,65,2021-05-14 10:10:18.643000,2021-05-14 10:11:19.576000,0:01:00.933000
JPN,ENU,jpneng2513a,NHK_0425002735_AS12RSTFRORNtrg-rmt.en.txt,405,また，十二指腸からの鉄吸収は十二指腸のトランスポーター（ＤＭＴ‐１とフェロポーチン‐１）によって調節されている。,68,2021-05-17 06:51:11.047000,2021-05-17 06:51:27.295000,0:00:16.248000
JPN,ENU,jpneng2510e,NHK_0425002735_AS12RSTFRORNtrg-rmt.en.txt,406,鉄過剰症はこれらの遺伝子の異常によることが明らかになって来ている。,49,2021-05-14 17:40:27.637000,2021-05-14 17:40:41.415000,0:00:13.778000
JPN,ENU,jpneng25149,NHK_0425002735_AS12RSTFRORNtrg-rmt.en.txt,407,また最近，ヘプシチジンとヘモジュベリンが十二指腸からの鉄吸収を制御することが分かった。,91,2021-05-17 05:19:20.932000,2021-05-17 05:19:31.830000,0:00:10.898000
JPN,ENU,jpneng25142,NHK_0425002735_AS12RSTFRORNtrg-rmt.en.txt,408,一部の無精子症の男性はＹ染色体上熱ショック転写因子（ＨＳＦＹ）を含むＹ染色体の領域を消失している。,100,2021-05-17 15:07:27.734000,2021-05-17 15:07:36.193000,0:00:08.459000
JPN,ENU,jpneng25118,NHK_0425002735_AS12RSTFRORNtrg-rmt.en.txt,409,マウスオーソログであるマウスＨＳＦＶ様配列（ｍＨＳＦＹＬ）の発現をｉｎ　ｓｉｔｕハイブリダイゼーションにより分析し，精巣のなかで主に精子細胞周囲に発現することがわかった。,77,2021-05-13 22:17:29.592000,2021-05-13 22:17:34.398000,0:00:04.806000
JPN,ENU,jpneng2512d,NHK_0425002735_AS12RSTFRORNtrg-rmt.en.txt,410,ＨＳＦＹ／ｍＨＳＦＹＬ類似の遺伝子を持つ生物種をデータベースで検索し，ヒト及びマウス以外にウシ，イヌ，ニワトリなどのほ乳類で認めた。,80,2021-05-19 01:58:42.002000,2021-05-19 01:58:52.309000,0:00:10.307000
JPN,ENU,jpneng25135,NHK_0425002735_AS12RSTFRORNtrg-rmt.en.txt,413,２，３，７，８‐テトラクロロジベンゾ‐ｐ‐ダイオキシン（ＴＣＤＤ）の小腸に対する影響を，形態及び機能の面から考察した。,98,2021-05-15 16:26:31.126000,2021-05-15 16:26:40.375000,0:00:09.249000
JPN,ENU,jpneng25115,NHK_0425002735_AS12RSTFRORNtrg-rmt.en.txt,414,小腸絨毛の上皮細胞における核／細胞比は，ＴＣＤＤ処理により増加する傾向を示した。,56,2021-05-19 06:22:26.049000,2021-05-19 06:22:40.329000,0:00:14.280000
JPN,ENU,jpneng25128,NHK_0425002735_AS12RSTFRORNtrg-rmt.en.txt,415,グルコース吸収能に対する影響を検討した結果，ＴＣＤＤ暴露Ｃ５７ＢＬ／６Ｊマウスは小腸におけるグルコース吸収能が増加した。,72,2021-05-19 21:15:48.576000,2021-05-19 21:15:59.285000,0:00:10.709000
JPN,ENU,jpneng25134,NHK_0425002735_AS12RSTFRORNtrg-rmt.en.txt,416,糖トランスポーターＳＧＬＵＴ１及びグルコーストランスポーター２　ｍＲＮＡの増加，ＳＧＬＵＴ１蛋白質の増加，ラクターゼ，マルターゼ活性の増加などの可能性が示唆された。,100,2021-05-17 04:46:13.653000,2021-05-17 04:47:00.144000,0:00:46.491000
JPN,ENU,jpneng25147,NHK_0425002735_AS12RSTFRORNtrg-rmt.en.txt,417,グルコース吸収能促進は，ダイオキシンによる体内糖利用効率低下を補償する機構であることが示唆された。,51,2021-05-16 19:55:29.660000,2021-05-16 19:55:40.424000,0:00:10.764000
JPN,ENU,jpneng25118,NHK_0425002735_AS12RSTFRORNtrg-rmt.en.txt,418,生命活動には，単に遺伝子配列や蛋白質の機能解析からは予測できない動的な生命活動がある。,99,2021-05-13 21:27:43.213000,2021-05-13 22:15:00.940000,0:47:17.727000
JPN,ENU,jpneng25138,NHK_0425002735_AS12RSTFRORNtrg-rmt.en.txt,419,その代表例として，染色体構造などの空間パターン形成を取り上げた。,94,2021-05-15 18:58:24.733000,2021-05-15 18:58:29.510000,0:00:04.777000
JPN,ENU,jpneng2513a,NHK_0425002735_AS12RSTFRORNtrg-rmt.en.txt,420,染色体位置の情報として染色体バンド番号を使い，その番号がアサインされている染色体を集め，機能的位置があるかどうか調べた。,50,2021-05-17 06:34:36.381000,2021-05-17 06:34:50.533000,0:00:14.152000
JPN,ENU,jpneng25104,NHK_0425002735_AS12RSTFRORNtrg-rmt.en.txt,421,その結果，一次元のゲノムの位置と染色体位置とは必ずしも一致が見られなかった。,82,2021-05-13 23:25:55.381000,2021-05-13 23:26:12.469000,0:00:17.088000
JPN,ENU,jpneng2514b,NHK_0425002735_AS12RSTFRORNtrg-rmt.en.txt,423,高低２種の虫害を受けたコナラ若木における栄養段階につき，補償への対応状況を比較した。,67,2021-05-17 07:18:33.710000,2021-05-17 07:18:53.719000,0:00:20.009000
JPN,ENU,jpneng25102,NHK_0425002735_AS12RSTFRORNtrg-rmt.en.txt,424,この実験では，若木全葉に補償値を予じめ特定しておく作業を施してあった。,65,2021-05-14 10:05:42.483000,2021-05-14 10:06:01.552000,0:00:19.069000
JPN,ENU,jpneng25134,NHK_0425002735_AS12RSTFRORNtrg-rmt.en.txt,425,その後に，土壌肥沃度を変えた区に置いて枝を成長させた。,46,2021-05-17 05:29:21.244000,2021-05-17 05:29:27.226000,0:00:05.982000
JPN,ENU,jpneng2512e,NHK_0425002735_AS12RSTFRORNtrg-rmt.en.txt,426,芽の成長と枝の伸びとはコナラ独自の因子によるもので，食害への対応は個々のレベルにより支配されていた。,68,2021-05-19 03:22:31.835000,2021-05-19 03:22:38.239000,0:00:06.404000
JPN,ENU,jpneng25111,NHK_0425002735_AS12RSTFRORNtrg-rmt.en.txt,427,食害を受けた２次枝・３次枝の伸びは土壌肥沃度が悪いと有意に悪かった。,64,2021-05-15 00:03:04.261000,2021-05-15 00:03:42.861000,0:00:38.600000
JPN,ENU,jpneng25119,NHK_0425002735_AS12RSTFRORNtrg-rmt.en.txt,429,メトキシ末端とチオール末端を持つＰＥＧを利用しての，バイオセンサアレイ用のＡｕ表面の細胞親和性パターンの形成について報告した。,85,2021-05-17 22:40:10.027000,2021-05-17 22:40:23.839000,0:00:13.812000
JPN,ENU,jpneng25109,NHK_0425002735_AS12RSTFRORNtrg-rmt.en.txt,430,分子量２ｋと５ｋのＭｅＯ‐ＰＥＧ‐ＳＨの緩衝溶液でＡｕ表面を処理して，細胞反発性の表面を形成した。,81,2021-05-14 17:39:10.411000,2021-05-14 17:40:04.188000,0:00:53.777000
JPN,ENU,jpneng25142,NHK_0425002735_AS12RSTFRORNtrg-rmt.en.txt,431,次いで，プラズマエッチング法によって細胞親和性のマイクロアレイを形成した。,100,2021-05-17 15:41:24.517000,2021-05-17 15:41:29.885000,0:00:05.368000
JPN,ENU,jpneng25101,NHK_0425002735_AS12RSTFRORNtrg-rmt.en.txt,433,径１０μｍ，間隔１００μｍの細胞親和性のマイクロアレイが形成できた。,90,2021-05-15 19:28:45.081000,2021-05-15 19:29:38.574000,0:00:53.493000
JPN,ENU,jpneng25107,NHK_0425002735_AS12RSTFRORNtrg-rmt.en.txt,434,飲酒した際の身体平衡を維持する系や中枢神経系の機能低下による重心動揺特性を調べ，高齢化に伴う身体機能の低下による直立不能に至るメカニズムの一端を明らかにした。,68,2021-05-15 06:53:54.185000,2021-05-15 06:54:23.887000,0:00:29.702000
JPN,ENU,jpneng25146,NHK_0425002735_AS12RSTFRORNtrg-rmt.en.txt,435,足底面内の重心動揺特性を重心動揺計を用いて調べた。,50,2021-05-16 19:02:30.243000,2021-05-16 19:02:45.896000,0:00:15.653000
JPN,ENU,jpneng25103,NHK_0425002735_AS12RSTFRORNtrg-rmt.en.txt,436,飲酒の影響で転倒する場合，前後方向か左右方向（あるいは両方向）の変位の動揺が急に増加した。,76,2021-05-14 07:53:16.649000,2021-05-14 07:53:25.571000,0:00:08.922000
JPN,ENU,jpneng25131,NHK_0425002735_AS12RSTFRORNtrg-rmt.en.txt,437,この場合，重心の移動距離が前後方向（あるいは両方向）で急激に大きくなり転倒に至った。,99,2021-05-14 17:39:39.009000,2021-05-14 17:39:48.983000,0:00:09.974000
JPN,ENU,jpneng2511a,NHK_0425002735_AS12RSTFRORNtrg-rmt.en.txt,438,転倒時の直前における前後方向か左右方向（あるいは両方向）の重心動揺速度振幅のｐ‐ｐ値は急激に増加した。,50,2021-05-19 05:59:55.009000,2021-05-19 06:00:03.330000,0:00:08.321000
JPN,ENU,jpneng2511c,NHK_0425002735_AS12RSTFRORNtrg-rmt.en.txt,439,また，一般に正常時の速度変化が小さい被験者は転倒に至るまでの時間が長かった。,29,2021-05-14 21:39:01.580000,2021-05-14 21:39:18.674000,0:00:17.094000
JPN,ENU,jpneng25120,NHK_0425002735_AS12RSTFRORNtrg-rmt.en.txt,440,胎児発育が出生後の成長パターン及び体組成を決定するかについて，天竜市における学校検診受診者を対象に解析した。,15,2021-05-14 05:01:09.405000,2021-05-14 05:02:14.823000,0:01:05.418000
JPN,ENU,jpneng2511b,NHK_0425002735_AS12RSTFRORNtrg-rmt.en.txt,441,低出生体重児の血中レプチン値に男女差が認められた。,80,2021-05-18 01:47:56.514000,2021-05-18 01:48:08.469000,0:00:11.955000
JPN,ENU,jpneng25137,NHK_0425002735_AS12RSTFRORNtrg-rmt.en.txt,442,また出生体重（胎内発育）は出生後の成長パターンを決定することが示唆された。,82,2021-05-16 10:29:49.235000,2021-05-16 10:30:01.716000,0:00:12.481000
JPN,ENU,jpneng25125,NHK_0425002735_AS12RSTFRORNtrg-rmt.en.txt,443,得られた結果は，胎内環境が出生後の成長パターン及び体組成を決定する重要な因子であることを示した。,76,2021-05-15 04:18:58.524000,2021-05-15 04:19:15.762000,0:00:17.238000
JPN,ENU,jpneng25124,NHK_0425002735_AS12RSTFRORNtrg-rmt.en.txt,444,肥満を含めたメタボリックシンドロームの増加が，社会的な問題になっている。,99,2021-05-13 23:27:51.745000,2021-05-13 23:27:57.287000,0:00:05.542000
JPN,ENU,jpneng2513a,NHK_0425002735_AS12RSTFRORNtrg-rmt.en.txt,445,Ｎｅｔｅａらは，ＩＬ‐１８が肥満症及びインスリン抵抗性に対して抑制的に働くことを報告した。,74,2021-05-17 06:58:26.558000,2021-05-17 06:58:34.402000,0:00:07.844000
JPN,ENU,jpneng2511a,NHK_0425002735_AS12RSTFRORNtrg-rmt.en.txt,446,著者らはＩＬ‐１８ノックアウトマウスと野生型マウスを比較した。,75,2021-05-19 02:40:36.726000,2021-05-19 02:40:50.143000,0:00:13.417000
JPN,ENU,jpneng25104,NHK_0425002735_AS12RSTFRORNtrg-rmt.en.txt,447,その結果，ＩＬ‐１８ノックアウトマウスは６〜２４か月にかけて体重，体脂肪率及び摂食量が増加した。,82,2021-05-13 22:50:25.814000,2021-05-13 22:50:33.940000,0:00:08.126000
JPN,ENU,jpneng25110,NHK_0425002735_AS12RSTFRORNtrg-rmt.en.txt,448,すなわち，ＩＬ‐１８の欠損が肥満につながることが示された。,89,2021-05-14 17:15:08.089000,2021-05-14 17:15:26.507000,0:00:18.418000
JPN,ENU,jpneng25108,NHK_0425002735_AS12RSTFRORNtrg-rmt.en.txt,449,始原生殖細胞（ＰＧＣ）に多く発現する遺伝子のうち，相対的発現量が７番目に多いのものにＰＧＣ７と命名した。,47,2021-05-14 15:56:07.573000,2021-05-14 15:56:45.140000,0:00:37.567000
JPN,ENU,jpneng25137,NHK_0425002735_AS12RSTFRORNtrg-rmt.en.txt,450,これは，後にケンブリッジ大から発表された遺伝子Ｓｔｅｌｌａと同じであった。,79,2021-05-16 10:27:14.935000,2021-05-16 10:27:20.722000,0:00:05.787000
JPN,ENU,jpneng2512b,NHK_0425002735_AS12RSTFRORNtrg-rmt.en.txt,451,その後の研究により，ＰＧＣ７／Ｓｔｅｌｌａは卵の成熟過程でなく，受精後の早い段階で核に移行して機能を発揮することが判明した。,94,2021-05-16 03:58:35.687000,2021-05-16 03:59:36.259000,0:01:00.572000
JPN,ENU,jpneng25131,NHK_0425002735_AS12RSTFRORNtrg-rmt.en.txt,452,さらに，ＰＧＣ７／Ｓｔｅｌｌａは脱メチル化を阻害することが分かった。,99,2021-05-14 18:09:15.975000,2021-05-14 18:09:27.694000,0:00:11.719000
JPN,ENU,jpneng25105,NHK_0425002735_AS12RSTFRORNtrg-rmt.en.txt,453,患者の機能回復程度を知るための握力測定法として，ファイバの形態変化による光伝搬特性の変化を利用したセンサの開発を試みた。,87,2021-05-14 10:30:35.225000,2021-05-14 10:30:59.368000,0:00:24.143000
JPN,ENU,jpneng25141,NHK_0425002735_AS12RSTFRORNtrg-rmt.en.txt,454,測定感度は６．８８ｍＶ／ｋｇで，現在使用されているスメドレー式では測定できない５００ｇ以下も測定できることが分った。,80,2021-05-19 02:11:08.161000,2021-05-19 02:11:14.975000,0:00:06.814000
JPN,ENU,jpneng25133,NHK_0425002735_AS12RSTFRORNtrg-rmt.en.txt,455,手指関節角度の測定精度は５度である。,81,2021-05-15 03:06:15.734000,2021-05-15 03:06:50.160000,0:00:34.426000
JPN,ENU,jpneng25134,NHK_0425002735_AS12RSTFRORNtrg-rmt.en.txt,456,外力印可部分の形状を変化させることによって測定レンジ，測定感度が変化する,99,2021-05-17 05:01:02.433000,2021-05-17 05:01:13.298000,0:00:10.865000
JPN,ENU,jpneng25149,NHK_0425002735_AS12RSTFRORNtrg-rmt.en.txt,457,Ｔ９８細胞を用いヒトグリオーマ細胞のタウリン摂取の特徴を調べた。,93,2021-05-17 06:16:58.096000,2021-05-17 06:17:07.151000,0:00:09.055000
JPN,ENU,jpneng2513d,NHK_0425002735_AS12RSTFRORNtrg-rmt.en.txt,458,Ｔ９８細胞のタウリン摂取は，Ｎａ＋依存性で高親和系を有し，ホルボール‐１２，１３‐ジブチラート（Ｉ，１００ｎＭ）やイソプロテレノール（１μＭ）投与で減少した。,79,2021-05-19 04:10:29.517000,2021-05-19 04:10:34.746000,0:00:05.229000
JPN,ENU,jpneng25122,NHK_0425002735_AS12RSTFRORNtrg-rmt.en.txt,459,またＨ‐７（１００ｎＭ）投与で影響を受けないが，Ｉの３０分前投与でタウリン摂取の減少効果のＥＣ５０が４１から８３ｎＭに上昇した。,79,2021-05-17 23:27:37.655000,2021-05-17 23:27:46.397000,0:00:08.742000
JPN,ENU,jpneng2513b,NHK_0425002735_AS12RSTFRORNtrg-rmt.en.txt,460,タウリン摂取に蛋白質キナーゼｃとｃＡＭＰが関与していることを考察した,83,2021-05-18 10:23:29.662000,2021-05-18 10:23:43.522000,0:00:13.860000
JPN,ENU,jpneng25123,NHK_0425002735_AS12RSTFRORNtrg-rmt.en.txt,461,標記システムの内，染色体標本の自動作成装置の開発の進捗状況を報告した。,78,2021-05-19 22:23:55.835000,2021-05-19 22:24:04.034000,0:00:08.199000
JPN,ENU,jpneng25129,NHK_0425002735_AS12RSTFRORNtrg-rmt.en.txt,462,試作装置を長期間実際に使用して，性能と操作性を評価した。,54,2021-05-16 12:38:19.620000,2021-05-16 12:38:30.054000,0:00:10.434000
JPN,ENU,jpneng25117,NHK_0425002735_AS12RSTFRORNtrg-rmt.en.txt,463,また，装置に適した細胞固定法の確立の研究を行った。,56,2021-05-18 03:16:02.748000,2021-05-18 03:16:16.303000,0:00:13.555000
JPN,ENU,jpneng25135,NHK_0425002735_AS12RSTFRORNtrg-rmt.en.txt,464,標本作製時の温度や湿度の機械的制御はほぼ目標に達した。,52,2021-05-15 16:15:42.577000,2021-05-15 16:15:52.402000,0:00:09.825000
JPN,ENU,jpneng25132,NHK_0425002735_AS12RSTFRORNtrg-rmt.en.txt,465,実用化のために，性能・操作性・外観・騒音などについて１０箇所の改良点を指摘した,80,2021-05-14 11:23:22.957000,2021-05-14 11:23:27.511000,0:00:04.554000
JPN,ENU,jpneng25119,NHK_0425002735_AS12RSTFRORNtrg-rmt.en.txt,466,ガラクトースα１→３ガラクトース（ＧＧ）はＧＳＩ‐Ｂ４レクチン（ＧＳ）によって特異的に染色される。,100,2021-05-17 23:16:36.044000,2021-05-17 23:16:52.543000,0:00:16.499000
JPN,ENU,jpneng25125,NHK_0425002735_AS12RSTFRORNtrg-rmt.en.txt,467,そこでＧＧ生合成に関与するα‐１，３‐ガラクトシルトランスフェラーゼのｃＤＮＡを組換えて，マウス受精卵に導入し，トランスジェニックマウスを作成した。,64,2021-05-15 01:42:47.939000,2021-05-15 01:42:56.853000,0:00:08.914000
JPN,ENU,jpneng25145,NHK_0425002735_AS12RSTFRORNtrg-rmt.en.txt,468,ついでＧＳを用いて調査したところ，視細杯外節，小腸林細胞，精母細胞周辺で新規のＧＧ分布を，また尿細管と肺胞上皮にはＧＧの増強を観察した。,76,2021-05-17 04:58:58.625000,2021-05-17 04:59:05.688000,0:00:07.063000
JPN,ENU,jpneng2511b,NHK_0425002735_AS12RSTFRORNtrg-rmt.en.txt,469,このマウスは蛋白尿が多くて脱毛，低体重及び突然死が多かった［１９９５．２］,79,2021-05-18 02:46:03.858000,2021-05-18 02:46:10.687000,0:00:06.829000
JPN,ENU,jpneng25110,NHK_0425002735_AS12RSTFRORNtrg-rmt.en.txt,470,キチナーゼ（Ｋ）のきっ抗型阻害剤（Ｉ）の合成を進めたところ，昆虫ＫのＩであるアロサミジン（Ａ）をキチンを出発物質として合成を検討したところ今回その全合成に成功した。,84,2021-05-14 17:48:31.078000,2021-05-14 17:50:42.388000,0:02:11.310000
JPN,ENU,jpneng25116,NHK_0425002735_AS12RSTFRORNtrg-rmt.en.txt,471,さらに上記合成の中間体を活用して酵母ＫのＩのデメチルアロサミジンについて立体選択的に全合成を達成した。,58,2021-05-17 06:28:05.583000,2021-05-17 06:28:13.415000,0:00:07.832000
JPN,ENU,jpneng2510b,NHK_0425002735_AS12RSTFRORNtrg-rmt.en.txt,472,さらにＡ及びその類似体についてカイコガ，Ｓａｃｃｈａｒｏｍｙｃｅｓ　ｃｅｒｅｖｉｓｉａｅ及びＴｒｉｃｈｏｄｅｒｍａ属のＫの阻害力を比較した。,65,2021-05-17 03:18:50.297000,2021-05-17 03:19:07,0:00:16.703000
JPN,ENU,jpneng2512e,NHK_0425002735_AS12RSTFRORNtrg-rmt.en.txt,473,その結果，構造活性相関に関して有用な知見を得た［１９９５．２］,51,2021-05-19 02:51:39.993000,2021-05-19 02:51:48.143000,0:00:08.150000
JPN,ENU,jpneng25132,NHK_0425002735_AS12RSTFRORNtrg-rmt.en.txt,474,ＩＬ‐１２によって誘導される先天免疫の活性化とそれに関与する細胞群について述べた。,79,2021-05-14 11:21:09.735000,2021-05-14 11:21:20.437000,0:00:10.702000
JPN,ENU,jpneng25103,NHK_0425002735_AS12RSTFRORNtrg-rmt.en.txt,475,ＩＬ‐１２は系統発生上異なった位置づけをもつＴ細胞群に共通した活性を示す分化因子である。,76,2021-05-14 07:45:00.611000,2021-05-14 07:45:10.956000,0:00:10.345000
JPN,ENU,jpneng25144,NHK_0425002735_AS12RSTFRORNtrg-rmt.en.txt,476,癌免疫では，ＭＨＣ非拘束性認識から，癌ペプチドなどによる抗原特異的認識に連なるシークエンスの回転を促す作用も期待できるものと思われた。,79,2021-05-16 23:19:45.664000,2021-05-16 23:19:55.701000,0:00:10.037000
JPN,ENU,jpneng25147,NHK_0425002735_AS12RSTFRORNtrg-rmt.en.txt,477,ＩＬ‐１２の癌に対する抵抗性（先天免疫）の生物反応についても考察した,99,2021-05-16 19:32:53.532000,2021-05-16 19:33:01.526000,0:00:07.994000
JPN,ENU,jpneng2511f,NHK_0425002735_AS12RSTFRORNtrg-rmt.en.txt,478,３ＭＶタンデム加速器のビームラインに連結した細胞用照射装置を用いて標的でのイオン飛程がビーム窓から標的までの距離により制御できることをこれまでに実証した。,99,2021-05-15 06:04:52.022000,2021-05-15 06:05:08.322000,0:00:16.300000
