Source,Target,User,System,SegmentID,Segment,Score,Start,End,Delta
JPN,ENU,jpneng2513d,NHK_0425002735_AS12RSTFRORNtrg-rmt.en.txt,1362,また，動作電圧を，５０Ｖから１５Ｖに下げることができた。,85,2021-05-19 04:08:13.982000,2021-05-19 04:08:23.942000,0:00:09.960000
JPN,ENU,jpneng2510c,NHK_0425002735_AS12RSTFRORNtrg-rmt.en.txt,1363,ＴＦＴ制御による安定化は非常に有効であり，０．１の放出揺らぎを得た。,91,2021-05-15 22:52:54.710000,2021-05-15 22:54:16.489000,0:01:21.779000
JPN,ENU,jpneng25128,NHK_0425002735_AS12RSTFRORNtrg-rmt.en.txt,1364,さらに，チューブレス真空封止をディスプレイ応用用に新開発した。,90,2021-05-19 22:45:23.192000,2021-05-19 22:45:29.401000,0:00:06.209000
JPN,ENU,jpneng2510d,NHK_0425002735_AS12RSTFRORNtrg-rmt.en.txt,1365,ＦＰＵシステムのデジタル化に伴い，ＦＰＵ単体およびデジタル周辺機器のリモート制御・監視が従来に比べ非常に複雑になった。,81,2021-05-14 16:34:38.742000,2021-05-14 16:35:00.652000,0:00:21.910000
JPN,ENU,jpneng2511c,NHK_0425002735_AS12RSTFRORNtrg-rmt.en.txt,1366,その複雑化に対応するため，開発・製品化を行ったＮＨＫ向けＦＰＵリモコン装置の概要を紹介した。,99,2021-05-14 21:04:02.359000,2021-05-14 21:04:19.224000,0:00:16.865000
JPN,ENU,jpneng25105,NHK_0425002735_AS12RSTFRORNtrg-rmt.en.txt,1367,基地局側設置のＦＰＵローカル操作板は，各機器への制御・監視，および放送会館側ＦＰＵリモート操作板とのデータ伝送を行う機能を有している。,89,2021-05-14 10:35:16.545000,2021-05-14 10:35:29.493000,0:00:12.948000
JPN,ENU,jpneng2510d,NHK_0425002735_AS12RSTFRORNtrg-rmt.en.txt,1368,基地局側および放送会館側設置の電源制御板は１台で最大４系統の送受信機の電源制御を行う機能を有している。,54,2021-05-14 16:35:56.184000,2021-05-14 16:36:18.794000,0:00:22.610000
JPN,ENU,jpneng2510f,NHK_0425002735_AS12RSTFRORNtrg-rmt.en.txt,1370,分路巻線のみに補助巻線を持つ超電導単相単巻変圧器を試作した。,84,2021-05-14 01:25:10.950000,2021-05-14 01:25:17.581000,0:00:06.631000
JPN,ENU,jpneng25112,NHK_0425002735_AS12RSTFRORNtrg-rmt.en.txt,1371,直列巻線と分路巻線との間にＦＲＰ円筒を挿入したので常に分路巻線のみでクエンチを起こすことを確認した。,67,2021-05-15 08:16:50.672000,2021-05-15 08:17:26.092000,0:00:35.420000
JPN,ENU,jpneng2511e,NHK_0425002735_AS12RSTFRORNtrg-rmt.en.txt,1372,変圧器の定常時および系統故障時の運転を確認した。,85,2021-05-18 02:58:25.681000,2021-05-18 02:58:36.848000,0:00:11.167000
JPN,ENU,jpneng25117,NHK_0425002735_AS12RSTFRORNtrg-rmt.en.txt,1373,定常時における補助巻線への分流は５．２％程と小さかった,65,2021-05-18 03:23:33.628000,2021-05-18 03:23:57.358000,0:00:23.730000
JPN,ENU,jpneng25103,NHK_0425002735_AS12RSTFRORNtrg-rmt.en.txt,1374,方形波及びＰＷＭインバータで駆動した時の非同期トルク特性に及ぼすｄ，ｑ軸回転子の機器定数の影響を調べた。,66,2021-05-14 08:31:30.902000,2021-05-14 08:31:54.285000,0:00:23.383000
JPN,ENU,jpneng25135,NHK_0425002735_AS12RSTFRORNtrg-rmt.en.txt,1375,任意の波形の電源電圧で駆動時の特性を統一的に解析でき有用な方法であることが確かめられた。,47,2021-05-15 16:35:25.182000,2021-05-15 16:35:40.062000,0:00:14.880000
JPN,ENU,jpneng25127,NHK_0425002735_AS12RSTFRORNtrg-rmt.en.txt,1376,供試電動機の定格は，３相，４極，１０ＨＰ，２２０Ｖ，６０Ｈｚである。,96,2021-05-14 19:12:07.078000,2021-05-14 19:12:26.327000,0:00:19.249000
JPN,ENU,jpneng25103,NHK_0425002735_AS12RSTFRORNtrg-rmt.en.txt,1377,リアクタンスを変化したときのすべり‐トルク特性を示し，ゲルゲス現象との関係を示した,64,2021-05-14 08:33:05.190000,2021-05-14 08:33:14.608000,0:00:09.418000
JPN,ENU,jpneng25129,NHK_0425002735_AS12RSTFRORNtrg-rmt.en.txt,1379,水平洞道部では，ケーブル占有スペース面から水平スネークまたは縦スネークが採用されており，スネークピッチと幅を実績から決定した。,76,2021-05-15 22:10:52.882000,2021-05-15 22:11:21.707000,0:00:28.825000
JPN,ENU,jpneng25149,NHK_0425002735_AS12RSTFRORNtrg-rmt.en.txt,1380,傾斜洞道部では水平スネークを適用し，垂直洞道部では全長スネーク布設を適用した。,96,2021-05-17 05:48:52.474000,2021-05-17 05:49:01.378000,0:00:08.904000
JPN,ENU,jpneng25149,NHK_0425002735_AS12RSTFRORNtrg-rmt.en.txt,1381,何れも自重把持のため拘束型クリートを取付ける,94,2021-05-17 05:41:02.461000,2021-05-17 05:41:24.439000,0:00:21.978000
JPN,ENU,jpneng25148,NHK_0425002735_AS12RSTFRORNtrg-rmt.en.txt,1382,ＬＥＤを光源とし，その集合した光によって時計を表示する床時計を紹介した。,65,2021-05-17 13:50:00.361000,2021-05-17 13:50:13.616000,0:00:13.255000
JPN,ENU,jpneng25145,NHK_0425002735_AS12RSTFRORNtrg-rmt.en.txt,1383,床時計の構成，電気の供給，施工上の注意点，材料の寿命および今後の課題について述べた。,80,2021-05-17 05:36:20.201000,2021-05-17 05:36:23.455000,0:00:03.254000
JPN,ENU,jpneng2511a,NHK_0425002735_AS12RSTFRORNtrg-rmt.en.txt,1384,新製品としてＬＥＤと人造大理石を一体化したものを紹介した。,55,2021-05-19 05:38:46.512000,2021-05-19 05:39:05.784000,0:00:19.272000
JPN,ENU,jpneng25114,NHK_0425002735_AS12RSTFRORNtrg-rmt.en.txt,1385,用途上の課題として防災上での床面を利用した避難・誘導表示をあげた,84,2021-05-15 17:07:20.484000,2021-05-15 17:07:45.481000,0:00:24.997000
JPN,ENU,jpneng2511b,NHK_0425002735_AS12RSTFRORNtrg-rmt.en.txt,1386,揚水用水中モータポンプの始動特性向上のため，電源電圧を３段階に変えることができる可変リアクトル始動装置を開発し，直入始動と比較実験を行った。,79,2021-05-18 01:28:56.550000,2021-05-18 01:30:26.648000,0:01:30.098000
JPN,ENU,jpneng25144,NHK_0425002735_AS12RSTFRORNtrg-rmt.en.txt,1387,電動機を電源に接続したまま順次電圧を上昇できるため，加速特性も円滑で始動時のショックも少ない。,79,2021-05-16 22:57:04.752000,2021-05-16 22:57:12.438000,0:00:07.686000
JPN,ENU,jpneng2513b,NHK_0425002735_AS12RSTFRORNtrg-rmt.en.txt,1388,また，直入始動に比べ始動電流，始動電力も低減できる。,57,2021-05-18 14:32:55.131000,2021-05-18 14:33:06.968000,0:00:11.837000
JPN,ENU,jpneng25115,NHK_0425002735_AS12RSTFRORNtrg-rmt.en.txt,1389,始動装置は無誘導回路として始動ができる,65,2021-05-19 05:56:58.355000,2021-05-19 05:57:07.145000,0:00:08.790000
JPN,ENU,jpneng2513b,NHK_0425002735_AS12RSTFRORNtrg-rmt.en.txt,1390,安定化銅を含まない超伝導素線６本とＣｕＮｉ中心線１本の撚線７ｍを１層巻にして限流器を試作した。,68,2021-05-18 10:31:46.750000,2021-05-18 10:31:56.099000,0:00:09.349000
JPN,ENU,jpneng2511f,NHK_0425002735_AS12RSTFRORNtrg-rmt.en.txt,1391,複数の変圧器を組み合せて大電流突発短絡電流の通電回路を構成し，限流動作を実験的に調べた。,99,2021-05-15 05:39:05.169000,2021-05-15 05:39:15.429000,0:00:10.260000
JPN,ENU,jpneng25141,NHK_0425002735_AS12RSTFRORNtrg-rmt.en.txt,1392,電流上昇率が大きくなると限流開始電流値は増大した。,71,2021-05-19 02:45:10.045000,2021-05-19 02:45:28.273000,0:00:18.228000
JPN,ENU,jpneng2514a,NHK_0425002735_AS12RSTFRORNtrg-rmt.en.txt,1393,クエンチ前後での限流器巻線における素線間電流の分流の進行状況も調べた,5,2021-05-18 01:27:47.710000,2021-05-18 01:28:00.004000,0:00:12.294000
JPN,ENU,jpneng25147,NHK_0425002735_AS12RSTFRORNtrg-rmt.en.txt,1394,３次元コンピュータの製作で最も難しい技術課題の一つは，積層（Ｚ）方向の電気接続である。,100,2021-05-16 19:35:58.368000,2021-05-16 19:36:04.081000,0:00:05.713000
JPN,ENU,jpneng25118,NHK_0425002735_AS12RSTFRORNtrg-rmt.en.txt,1395,一方，冷却の必要から，ウエハ間の距離は縮められない。,77,2021-05-13 21:20:09.393000,2021-05-13 21:20:17.479000,0:00:08.086000
JPN,ENU,jpneng2512b,NHK_0425002735_AS12RSTFRORNtrg-rmt.en.txt,1396,その結果，Ｚ配線導体の長さ／直径比は増加し，導体形成時の安定性の保持が難しくなる。,89,2021-05-16 04:31:18.954000,2021-05-16 04:32:55.127000,0:01:36.173000
JPN,ENU,jpneng2511a,NHK_0425002735_AS12RSTFRORNtrg-rmt.en.txt,1397,本研究では，基本モデルとして，一個のはんだブリッジを用い，その形成過程を観察した［１９９４．３］,75,2021-05-19 02:05:25.915000,2021-05-19 02:05:39.133000,0:00:13.218000
JPN,ENU,jpneng25114,NHK_0425002735_AS12RSTFRORNtrg-rmt.en.txt,1398,標記設備は，排煙脱硫，排脱排水，総合排水，灰処理，揚運炭，石炭の湾受け入れなどの設備から成る。,89,2021-05-15 17:16:28.535000,2021-05-15 17:16:50.697000,0:00:22.162000
JPN,ENU,jpneng2513a,NHK_0425002735_AS12RSTFRORNtrg-rmt.en.txt,1399,これらの制御装置の統合システムが導入されるようになった。,73,2021-05-17 06:29:25.149000,2021-05-17 06:29:44.121000,0:00:18.972000
JPN,ENU,jpneng25103,NHK_0425002735_AS12RSTFRORNtrg-rmt.en.txt,1400,統合化システムは，１台で全設備の情報入手ができ，設備の異常の総合管理が可能，管理の負担が軽減でき，コストが低減する。,75,2021-05-14 07:54:50.660000,2021-05-14 07:55:00.962000,0:00:10.302000
JPN,ENU,jpneng25113,NHK_0425002735_AS12RSTFRORNtrg-rmt.en.txt,1401,電源は重要な制御装置にはＡＣ１００，ＤＣ１００を直接供給する,59,2021-05-14 16:45:27.857000,2021-05-14 16:45:30.320000,0:00:02.463000
JPN,ENU,jpneng2512c,NHK_0425002735_AS12RSTFRORNtrg-rmt.en.txt,1402,高解像度シースルー・カラーＨＭＤの試作を行い，人工現実感の研究等に使用する製品を開発した。,80,2021-05-16 01:27:02.021000,2021-05-16 01:27:13.746000,0:00:11.725000
JPN,ENU,jpneng25137,NHK_0425002735_AS12RSTFRORNtrg-rmt.en.txt,1403,ゴーグル機能として使用するだけでなく，シースルー機能を持たせた。,81,2021-05-16 10:45:35.910000,2021-05-16 10:45:46.967000,0:00:11.057000
JPN,ENU,jpneng25136,NHK_0425002735_AS12RSTFRORNtrg-rmt.en.txt,1404,このシースルー機能と表示画像，調整機構等の特徴と設計上の考慮点につき述べた。,80,2021-05-16 08:28:25.068000,2021-05-16 08:28:34.184000,0:00:09.116000
JPN,ENU,jpneng2513a,NHK_0425002735_AS12RSTFRORNtrg-rmt.en.txt,1405,また，仕様・性能・解像度等も紹介した,76,2021-05-17 06:45:37.431000,2021-05-17 06:45:50.351000,0:00:12.920000
JPN,ENU,jpneng25121,NHK_0425002735_AS12RSTFRORNtrg-rmt.en.txt,1406,郵政省が毎年発表し，今回２３回目に当たる標記白書の概要を述べた。,26,2021-05-15 06:03:46.891000,2021-05-15 06:04:02.053000,0:00:15.162000
JPN,ENU,jpneng2511b,NHK_0425002735_AS12RSTFRORNtrg-rmt.en.txt,1407,まず，情報通信の現況および情報通信政策の動向を概観するとともに，情報通信に関する経済分析および昭和６０年の電気通信自由化後１０年間の動向を分析した。,79,2021-05-18 02:15:08.674000,2021-05-18 02:15:13.774000,0:00:05.100000
JPN,ENU,jpneng25111,NHK_0425002735_AS12RSTFRORNtrg-rmt.en.txt,1408,また，「マルチメディア化と情報通信市場の変革」をテーマとして取り上げ，情報通信市場への競争原理の導入から１０年が経過し，情報通信市場が大きな転機を迎えている中，現在の動向を政府，利用者，情報通信産業の三つの側面から紹介した。,24,2021-05-15 00:08:43.702000,2021-05-15 00:08:57.700000,0:00:13.998000
JPN,ENU,jpneng2510d,NHK_0425002735_AS12RSTFRORNtrg-rmt.en.txt,1409,さらに，米国の情報通信市場を一例として取り上げて分析し，最後に日本の情報通信市場の変革に向けた課題とそれに資する情報通信政策について明らかにした,46,2021-05-14 15:11:07.657000,2021-05-14 15:11:45.439000,0:00:37.782000
JPN,ENU,jpneng25134,NHK_0425002735_AS12RSTFRORNtrg-rmt.en.txt,1410,本文は，従来半導体工場に３系統あった排気設備の統合作業紹介である。,32,2021-05-17 05:28:29.747000,2021-05-17 05:28:38.758000,0:00:09.011000
JPN,ENU,jpneng25116,NHK_0425002735_AS12RSTFRORNtrg-rmt.en.txt,1411,主目的は生産設備増設への対応と既存設備の稼働率向上にある。,61,2021-05-17 04:33:21.762000,2021-05-17 04:33:28.323000,0:00:06.561000
JPN,ENU,jpneng2512c,NHK_0425002735_AS12RSTFRORNtrg-rmt.en.txt,1412,統合後はエピ成長装置の排気だけがＨＣｌスクラバーを通り，その他は新設した吸込チャンバーへ直接流れ込む。,97,2021-05-15 21:49:20.458000,2021-05-15 21:49:30.699000,0:00:10.241000
JPN,ENU,jpneng25115,NHK_0425002735_AS12RSTFRORNtrg-rmt.en.txt,1413,最終段のエピ系スクラバーが排気を大気中に放出する。,63,2021-05-19 06:51:12.206000,2021-05-19 06:51:18.664000,0:00:06.458000
JPN,ENU,jpneng25104,NHK_0425002735_AS12RSTFRORNtrg-rmt.en.txt,1414,濃度は検出限界２ｐｐｍ以下であり，環境基準を満たしている,86,2021-05-13 23:16:52.371000,2021-05-13 23:17:08.110000,0:00:15.739000
JPN,ENU,jpneng25129,NHK_0425002735_AS12RSTFRORNtrg-rmt.en.txt,1415,本文は標記問題の解説記事である。,91,2021-05-16 12:32:24.826000,2021-05-16 12:32:28.886000,0:00:04.060000
JPN,ENU,jpneng25123,NHK_0425002735_AS12RSTFRORNtrg-rmt.en.txt,1416,本文ではまずＥＳＤ（静電気放電）など用語の定義を解説した。,83,2021-05-19 22:29:17.260000,2021-05-19 22:29:45.897000,0:00:28.637000
JPN,ENU,jpneng2510a,NHK_0425002735_AS12RSTFRORNtrg-rmt.en.txt,1417,次にＩＣ破壊と帯電経路を分類し，人体でも３５ｋＶの帯電が起ることを表で示した。,80,2021-05-18 23:36:05.653000,2021-05-18 23:36:12.106000,0:00:06.453000
JPN,ENU,jpneng25108,NHK_0425002735_AS12RSTFRORNtrg-rmt.en.txt,1418,対策としては導電性のテーブルマットとフロアマット，リストストラップを挙げ，人体の静電容量も表で示した。,80,2021-05-14 15:42:26.186000,2021-05-14 15:42:40.762000,0:00:14.576000
JPN,ENU,jpneng2512d,NHK_0425002735_AS12RSTFRORNtrg-rmt.en.txt,1419,実際に作業者が着るリストストラップについては，静電電圧の時間変化をグラフで示した,52,2021-05-19 02:11:25.547000,2021-05-19 02:11:32.448000,0:00:06.901000
JPN,ENU,jpneng25149,NHK_0425002735_AS12RSTFRORNtrg-rmt.en.txt,1420,ダイヤモンドのヒートシンクとしての特性及び応用について述べた。,82,2021-05-17 05:32:50.959000,2021-05-17 05:33:11.057000,0:00:20.098000
JPN,ENU,jpneng25127,NHK_0425002735_AS12RSTFRORNtrg-rmt.en.txt,1421,ダイヤモンドの熱伝導率，熱膨張率及び電気特性をその外の材料と比較して示した。,100,2021-05-14 18:50:51.236000,2021-05-14 18:51:01.305000,0:00:10.069000
JPN,ENU,jpneng25146,NHK_0425002735_AS12RSTFRORNtrg-rmt.en.txt,1422,ヒートシンク用としては，高純度ダイヤモンド合成が必要であり，大面積で低コストを考えると気相法ダイヤモンドが適している。,89,2021-05-16 18:56:59.693000,2021-05-16 18:57:07.880000,0:00:08.187000
JPN,ENU,jpneng25125,NHK_0425002735_AS12RSTFRORNtrg-rmt.en.txt,1423,光通信用及びデバイス用ヒートシンクとしてのダイヤモンドについて，その現状と将来を概説した,50,2021-05-15 05:56:09.476000,2021-05-15 05:56:17.373000,0:00:07.897000
JPN,ENU,jpneng25123,NHK_0425002735_AS12RSTFRORNtrg-rmt.en.txt,1424,ラックス創業７０周年記念の一環として開発した標記のアンプは，ラジオ技術誌のベストステレオコンポグランプリの金賞受賞をはじめ，著名オーディオ誌で高い評価を得た。,75,2021-05-19 22:37:05.802000,2021-05-19 22:37:22.711000,0:00:16.909000
JPN,ENU,jpneng25114,NHK_0425002735_AS12RSTFRORNtrg-rmt.en.txt,1425,本機の企画意図，ＢＴＬ方式で５００Ｗ／８Ω仕様に決定するまでの経緯など述べた。,86,2021-05-15 16:23:12.240000,2021-05-15 16:23:31.768000,0:00:19.528000
JPN,ENU,jpneng25140,NHK_0425002735_AS12RSTFRORNtrg-rmt.en.txt,1426,バランス伝送のメリットや入力回路とアッテネータを解説し，初段をＦＥＴにしたツインハイブリッドダイヤモンドバッファ回路の特徴を述べた。,39,2021-05-16 03:36:34.141000,2021-05-16 03:37:00.049000,0:00:25.908000
JPN,ENU,jpneng2510d,NHK_0425002735_AS12RSTFRORNtrg-rmt.en.txt,1427,更にスピーカをＢＴＬ駆動するバランスＣＳＳＣ（相補型単一スタガ回路）と名付けたバランス増幅回路，バランスＣＳＳＣに施したＯＤβ（最適化デュアルＮＦＢ）と称する多重電流帰還の仕組みを解説した。,81,2021-05-14 14:46:36.070000,2021-05-14 14:48:39.565000,0:02:03.495000
JPN,ENU,jpneng2510b,NHK_0425002735_AS12RSTFRORNtrg-rmt.en.txt,1428,銅管入り銅箔スチロールコンデンサなどのカスタムパーツの採用，ハイイナーシャ電源，ＢＴＬ出力段の給電方式などを述べた,57,2021-05-17 02:34:54.938000,2021-05-17 02:35:02.502000,0:00:07.564000
JPN,ENU,jpneng25126,NHK_0425002735_AS12RSTFRORNtrg-rmt.en.txt,1429,首記製造技術の穴明けについて解説した。,77,2021-05-17 19:42:16.430000,2021-05-17 19:42:29.726000,0:00:13.296000
JPN,ENU,jpneng25110,NHK_0425002735_AS12RSTFRORNtrg-rmt.en.txt,1430,エキシマレーザ，炭酸ガスレーザ，Ｎｄ：ＹＡＧレーザのそれぞれのシステム概要と加工精度などの特徴を説明した。,88,2021-05-14 18:43:41.840000,2021-05-14 18:46:29.040000,0:02:47.200000
JPN,ENU,jpneng25120,NHK_0425002735_AS12RSTFRORNtrg-rmt.en.txt,1431,レーザによる適度なテーパをもつビルドアップバイアの形状，工程，品質，適用事例と問題点などを論じた。,23,2021-05-14 05:08:31.246000,2021-05-14 05:08:46.833000,0:00:15.587000
JPN,ENU,jpneng25126,NHK_0425002735_AS12RSTFRORNtrg-rmt.en.txt,1432,感光性樹脂を使用した光による穴明け，アルカリ，酸などの化学的なエッチング法を交え紹介した,99,2021-05-17 19:24:45.728000,2021-05-17 19:24:55.454000,0:00:09.726000
JPN,ENU,jpneng25101,NHK_0425002735_AS12RSTFRORNtrg-rmt.en.txt,1433,チップの一つの面に第１の放熱板を設け，他の面に第２の放熱板を設ける。,76,2021-05-15 15:16:45.149000,2021-05-15 15:18:32.877000,0:01:47.728000
JPN,ENU,jpneng25143,NHK_0425002735_AS12RSTFRORNtrg-rmt.en.txt,1434,第２の放熱板はチップ表面側のモールドに接合する。,88,2021-05-17 16:26:44.698000,2021-05-17 16:26:50.200000,0:00:05.502000
JPN,ENU,jpneng2513b,NHK_0425002735_AS12RSTFRORNtrg-rmt.en.txt,1435,接合はフレームのアウターリードをカットする際に圧着して行う。,58,2021-05-18 14:33:51.239000,2021-05-18 14:33:58.875000,0:00:07.636000
JPN,ENU,jpneng2510d,NHK_0425002735_AS12RSTFRORNtrg-rmt.en.txt,1437,これにより，アセンブリ工程数を増やすことなくパッケージの反りを防ぐとともに，放熱効果を上げることができる,90,2021-05-14 19:26:56.545000,2021-05-14 19:31:16.258000,0:04:19.713000
JPN,ENU,jpneng25135,NHK_0425002735_AS12RSTFRORNtrg-rmt.en.txt,1438,入射光と電気信号の間の相関検出器を２次元に配列する新しい形式のイメージセンサを提案した。,90,2021-05-15 16:13:21.567000,2021-05-15 16:13:32.751000,0:00:11.184000
JPN,ENU,jpneng2513b,NHK_0425002735_AS12RSTFRORNtrg-rmt.en.txt,1439,この構造の特徴は，１）入射フォトンを光電流（被乗数）に変換するフォトダイオード検出器，２）全画素に共通な外部電気信号入力（乗数），３）光電流と電気信号の積を生成する電流モード乗算器，４）積電流を積分して相関結果を蓄積するコンデンサ，５）相関結果を通常のビデオ信号として走査するＣＣＤまたはＭＯＳスイッチ回路，にある。,59,2021-05-18 14:30:42.098000,2021-05-18 14:31:11.124000,0:00:29.026000
JPN,ENU,jpneng25118,NHK_0425002735_AS12RSTFRORNtrg-rmt.en.txt,1440,いくつかの可能な構造と回路を提案し検証した。,99,2021-05-13 21:25:25.159000,2021-05-13 21:25:29.396000,0:00:04.237000
JPN,ENU,jpneng2510f,NHK_0425002735_AS12RSTFRORNtrg-rmt.en.txt,1441,また，このセンサの応用について検討した,85,2021-05-14 00:47:58.364000,2021-05-14 00:48:07.123000,0:00:08.759000
JPN,ENU,jpneng25107,NHK_0425002735_AS12RSTFRORNtrg-rmt.en.txt,1442,大画面壁掛テレビへの可能性に注目しつつ，ＰＤＰを用いた標記技術を解説した。,98,2021-05-15 06:35:46.386000,2021-05-15 06:35:59.723000,0:00:13.337000
JPN,ENU,jpneng25111,NHK_0425002735_AS12RSTFRORNtrg-rmt.en.txt,1443,テレビ表示への基本的前提となるＰＤＰのメモリ機能を先ず解説した。,80,2021-05-14 23:44:28.216000,2021-05-14 23:44:34.952000,0:00:06.736000
JPN,ENU,jpneng25121,NHK_0425002735_AS12RSTFRORNtrg-rmt.en.txt,1444,次いでテレビ表示方法として，表示の原理とＤＣ型及びＡＣ型表示方式を解説した。,45,2021-05-15 05:10:11.295000,2021-05-15 05:10:22.481000,0:00:11.186000
JPN,ENU,jpneng25135,NHK_0425002735_AS12RSTFRORNtrg-rmt.en.txt,1445,さらに表示システムの角度から解説した後，動画像劣化とその対策も説明した。,82,2021-05-15 16:03:44.014000,2021-05-15 16:03:57.320000,0:00:13.306000
JPN,ENU,jpneng25118,NHK_0425002735_AS12RSTFRORNtrg-rmt.en.txt,1446,通信架収容の電子回路基板に搭載のＤＣ‐ＤＣコンバータなど通信用オンボード電源の入力急変特性の評価装置について述べた。,76,2021-05-13 21:18:59.137000,2021-05-13 21:19:03.022000,0:00:03.885000
JPN,ENU,jpneng2513b,NHK_0425002735_AS12RSTFRORNtrg-rmt.en.txt,1447,ヒューズを挿入した時に発生する電圧変動を模擬する入力急変特性評価装置を構成した。,62,2021-05-18 08:50:01.693000,2021-05-18 08:51:34.527000,0:01:32.834000
JPN,ENU,jpneng25124,NHK_0425002735_AS12RSTFRORNtrg-rmt.en.txt,1448,実際の入力急変電圧波形をデータベース化し，ＤＡコンバータを通してＤＣアンプに出力して，任意波形の入力急変を可能にした。,76,2021-05-13 23:04:37.175000,2021-05-13 23:04:43.234000,0:00:06.059000
JPN,ENU,jpneng2512c,NHK_0425002735_AS12RSTFRORNtrg-rmt.en.txt,1449,正弦波半周期をオンボード電源に印加した動作確認の結果，目標通りの動作が得られることを確認した。,89,2021-05-15 22:09:56.238000,2021-05-15 22:10:04.228000,0:00:07.990000
JPN,ENU,jpneng25121,NHK_0425002735_AS12RSTFRORNtrg-rmt.en.txt,1450,電力系統の短絡事故箇所の除去のために発生する瞬時電圧低下の継続時間を，１サイクルに短縮する高速度真空遮断器を開発した。,89,2021-05-15 06:03:14.777000,2021-05-15 06:03:24.474000,0:00:09.697000
JPN,ENU,jpneng25118,NHK_0425002735_AS12RSTFRORNtrg-rmt.en.txt,1451,真空バルブ操作軸上の電磁反発コイルと引き外しコイルによる高速遮断機構を組み込んだ真空遮断器である。,99,2021-05-13 22:20:05.391000,2021-05-13 22:20:09.750000,0:00:04.359000
JPN,ENU,jpneng2514b,NHK_0425002735_AS12RSTFRORNtrg-rmt.en.txt,1452,検出時間は４ｍｓであった。,79,2021-05-17 07:49:14.734000,2021-05-17 07:49:17.445000,0:00:02.711000
JPN,ENU,jpneng25113,NHK_0425002735_AS12RSTFRORNtrg-rmt.en.txt,1453,解析では母線電圧６０％の低下事故を９６％まで回復できた。,77,2021-05-14 16:41:39.050000,2021-05-14 16:41:42.660000,0:00:03.610000
JPN,ENU,jpneng2512f,NHK_0425002735_AS12RSTFRORNtrg-rmt.en.txt,1454,キンセキ株式会社が開発した標記水晶製品を紹介した。,82,2021-05-19 01:38:01.012000,2021-05-19 01:38:05.643000,0:00:04.631000
JPN,ENU,jpneng25122,NHK_0425002735_AS12RSTFRORNtrg-rmt.en.txt,1455,形状的，コスト面仕様の標準化等から新製品ＣＸ‐１６Ｆの開発背景を説明した。,79,2021-05-17 23:37:55.256000,2021-05-17 23:38:07.223000,0:00:11.967000
JPN,ENU,jpneng2511d,NHK_0425002735_AS12RSTFRORNtrg-rmt.en.txt,1456,同製品は表面実装リードレスタイプの小形・薄形・低価格品であり，その外形寸法と内部構造を示した。,65,2021-05-19 07:10:21.631000,2021-05-19 07:10:33.595000,0:00:11.964000
JPN,ENU,jpneng25148,NHK_0425002735_AS12RSTFRORNtrg-rmt.en.txt,1457,同製品の標準周波数の決定，負荷容量，リフロソルダリング条件を述べた。,66,2021-05-17 12:52:36.325000,2021-05-17 12:52:43.322000,0:00:06.997000
JPN,ENU,jpneng2510d,NHK_0425002735_AS12RSTFRORNtrg-rmt.en.txt,1458,正と負の群速度分散を持つ光ファイバを交互に接続した伝送路を伝搬する準安定なＲＺ非線形パルスは分散マネージソリトン，分散アロケートソリトンあるいはストレッチパルスなどと呼ばれている。,94,2021-05-14 19:04:18.774000,2021-05-14 19:09:58.185000,0:05:39.411000
JPN,ENU,jpneng25144,NHK_0425002735_AS12RSTFRORNtrg-rmt.en.txt,1459,これらの非線形パルスは伝送方向に均一な以上分散性を持つファイバ中の通常の光ソリトンより優れた伝送特性を持つ可能性がある。,81,2021-05-16 23:02:26.811000,2021-05-16 23:02:43.159000,0:00:16.348000
