Source,Target,User,System,SegmentID,Segment,Score,Start,End,Delta
JPN,ENU,jpneng25129,TMU_0503132349_sorted_seg14.output.txt,1379,水平洞道部では，ケーブル占有スペース面から水平スネークまたは縦スネークが採用されており，スネークピッチと幅を実績から決定した。,82,2021-05-15 17:38:15.864000,2021-05-15 17:38:55.352000,0:00:39.488000
JPN,ENU,jpneng25149,TMU_0503132349_sorted_seg14.output.txt,1380,傾斜洞道部では水平スネークを適用し，垂直洞道部では全長スネーク布設を適用した。,44,2021-05-17 05:38:40.535000,2021-05-17 05:38:45.379000,0:00:04.844000
JPN,ENU,jpneng25149,TMU_0503132349_sorted_seg14.output.txt,1381,何れも自重把持のため拘束型クリートを取付ける,44,2021-05-17 05:18:47.203000,2021-05-17 05:19:19.522000,0:00:32.319000
JPN,ENU,jpneng25148,TMU_0503132349_sorted_seg14.output.txt,1382,ＬＥＤを光源とし，その集合した光によって時計を表示する床時計を紹介した。,47,2021-05-17 13:53:23.947000,2021-05-17 13:53:38.380000,0:00:14.433000
JPN,ENU,jpneng25145,TMU_0503132349_sorted_seg14.output.txt,1383,床時計の構成，電気の供給，施工上の注意点，材料の寿命および今後の課題について述べた。,63,2021-05-17 05:26:39.788000,2021-05-17 05:27:04.610000,0:00:24.822000
JPN,ENU,jpneng2511a,TMU_0503132349_sorted_seg14.output.txt,1384,新製品としてＬＥＤと人造大理石を一体化したものを紹介した。,27,2021-05-19 05:40:39.862000,2021-05-19 05:40:43.585000,0:00:03.723000
JPN,ENU,jpneng25114,TMU_0503132349_sorted_seg14.output.txt,1385,用途上の課題として防災上での床面を利用した避難・誘導表示をあげた,18,2021-05-15 17:23:33.771000,2021-05-15 17:23:56.801000,0:00:23.030000
JPN,ENU,jpneng2511b,TMU_0503132349_sorted_seg14.output.txt,1386,揚水用水中モータポンプの始動特性向上のため，電源電圧を３段階に変えることができる可変リアクトル始動装置を開発し，直入始動と比較実験を行った。,69,2021-05-18 01:31:54.473000,2021-05-18 01:32:22.737000,0:00:28.264000
JPN,ENU,jpneng25144,TMU_0503132349_sorted_seg14.output.txt,1387,電動機を電源に接続したまま順次電圧を上昇できるため，加速特性も円滑で始動時のショックも少ない。,74,2021-05-16 22:51:10.748000,2021-05-16 22:51:28.053000,0:00:17.305000
JPN,ENU,jpneng2513b,TMU_0503132349_sorted_seg14.output.txt,1388,また，直入始動に比べ始動電流，始動電力も低減できる。,50,2021-05-18 14:35:29.628000,2021-05-18 14:35:39.654000,0:00:10.026000
JPN,ENU,jpneng25115,TMU_0503132349_sorted_seg14.output.txt,1389,始動装置は無誘導回路として始動ができる,10,2021-05-19 05:46:39.283000,2021-05-19 05:47:01.897000,0:00:22.614000
JPN,ENU,jpneng2513b,TMU_0503132349_sorted_seg14.output.txt,1390,安定化銅を含まない超伝導素線６本とＣｕＮｉ中心線１本の撚線７ｍを１層巻にして限流器を試作した。,33,2021-05-18 09:13:55.762000,2021-05-18 09:15:26.625000,0:01:30.863000
JPN,ENU,jpneng2511f,TMU_0503132349_sorted_seg14.output.txt,1391,複数の変圧器を組み合せて大電流突発短絡電流の通電回路を構成し，限流動作を実験的に調べた。,2,2021-05-15 05:31:03.553000,2021-05-15 05:31:20.498000,0:00:16.945000
JPN,ENU,jpneng25141,TMU_0503132349_sorted_seg14.output.txt,1392,電流上昇率が大きくなると限流開始電流値は増大した。,36,2021-05-19 02:53:07.073000,2021-05-19 02:53:12.646000,0:00:05.573000
JPN,ENU,jpneng2514a,TMU_0503132349_sorted_seg14.output.txt,1393,クエンチ前後での限流器巻線における素線間電流の分流の進行状況も調べた,1,2021-05-18 01:28:43.120000,2021-05-18 01:28:49.436000,0:00:06.316000
JPN,ENU,jpneng25147,TMU_0503132349_sorted_seg14.output.txt,1394,３次元コンピュータの製作で最も難しい技術課題の一つは，積層（Ｚ）方向の電気接続である。,77,2021-05-16 19:34:51.340000,2021-05-16 19:34:57.123000,0:00:05.783000
JPN,ENU,jpneng25117,TMU_0503132349_sorted_seg14.output.txt,1395,一方，冷却の必要から，ウエハ間の距離は縮められない。,12,2021-05-18 01:47:48.593000,2021-05-18 01:48:33.296000,0:00:44.703000
JPN,ENU,jpneng2512b,TMU_0503132349_sorted_seg14.output.txt,1396,その結果，Ｚ配線導体の長さ／直径比は増加し，導体形成時の安定性の保持が難しくなる。,79,2021-05-16 04:41:41.965000,2021-05-16 04:41:46.287000,0:00:04.322000
JPN,ENU,jpneng2511a,TMU_0503132349_sorted_seg14.output.txt,1397,本研究では，基本モデルとして，一個のはんだブリッジを用い，その形成過程を観察した［１９９４．３］,51,2021-05-19 02:46:53.746000,2021-05-19 02:46:59.970000,0:00:06.224000
JPN,ENU,jpneng25114,TMU_0503132349_sorted_seg14.output.txt,1398,標記設備は，排煙脱硫，排脱排水，総合排水，灰処理，揚運炭，石炭の湾受け入れなどの設備から成る。,4,2021-05-15 17:32:07.141000,2021-05-15 17:32:26.610000,0:00:19.469000
JPN,ENU,jpneng2513a,TMU_0503132349_sorted_seg14.output.txt,1399,これらの制御装置の統合システムが導入されるようになった。,78,2021-05-17 06:25:56.414000,2021-05-17 06:26:16.774000,0:00:20.360000
JPN,ENU,jpneng25103,TMU_0503132349_sorted_seg14.output.txt,1400,統合化システムは，１台で全設備の情報入手ができ，設備の異常の総合管理が可能，管理の負担が軽減でき，コストが低減する。,33,2021-05-14 07:59:18.823000,2021-05-14 07:59:32.500000,0:00:13.677000
JPN,ENU,jpneng25113,TMU_0503132349_sorted_seg14.output.txt,1401,電源は重要な制御装置にはＡＣ１００，ＤＣ１００を直接供給する,55,2021-05-14 16:44:35.705000,2021-05-14 16:44:42.728000,0:00:07.023000
JPN,ENU,jpneng2512c,TMU_0503132349_sorted_seg14.output.txt,1402,高解像度シースルー・カラーＨＭＤの試作を行い，人工現実感の研究等に使用する製品を開発した。,59,2021-05-16 01:23:57.369000,2021-05-16 01:24:05.510000,0:00:08.141000
JPN,ENU,jpneng25137,TMU_0503132349_sorted_seg14.output.txt,1403,ゴーグル機能として使用するだけでなく，シースルー機能を持たせた。,58,2021-05-16 10:34:55.590000,2021-05-16 10:35:04.740000,0:00:09.150000
JPN,ENU,jpneng25136,TMU_0503132349_sorted_seg14.output.txt,1404,このシースルー機能と表示画像，調整機構等の特徴と設計上の考慮点につき述べた。,53,2021-05-16 08:28:54.066000,2021-05-16 08:29:02.463000,0:00:08.397000
JPN,ENU,jpneng2513a,TMU_0503132349_sorted_seg14.output.txt,1405,また，仕様・性能・解像度等も紹介した,25,2021-05-17 07:00:52.489000,2021-05-17 07:00:57.687000,0:00:05.198000
JPN,ENU,jpneng25121,TMU_0503132349_sorted_seg14.output.txt,1406,郵政省が毎年発表し，今回２３回目に当たる標記白書の概要を述べた。,3,2021-05-15 06:04:17.207000,2021-05-15 06:04:23.092000,0:00:05.885000
JPN,ENU,jpneng2511b,TMU_0503132349_sorted_seg14.output.txt,1407,まず，情報通信の現況および情報通信政策の動向を概観するとともに，情報通信に関する経済分析および昭和６０年の電気通信自由化後１０年間の動向を分析した。,76,2021-05-18 02:18:28.118000,2021-05-18 02:18:45.069000,0:00:16.951000
JPN,ENU,jpneng25111,TMU_0503132349_sorted_seg14.output.txt,1408,また，「マルチメディア化と情報通信市場の変革」をテーマとして取り上げ，情報通信市場への競争原理の導入から１０年が経過し，情報通信市場が大きな転機を迎えている中，現在の動向を政府，利用者，情報通信産業の三つの側面から紹介した。,57,2021-05-15 00:13:07.397000,2021-05-15 00:13:34.421000,0:00:27.024000
JPN,ENU,jpneng2510d,TMU_0503132349_sorted_seg14.output.txt,1409,さらに，米国の情報通信市場を一例として取り上げて分析し，最後に日本の情報通信市場の変革に向けた課題とそれに資する情報通信政策について明らかにした,48,2021-05-14 16:24:09.790000,2021-05-14 16:24:22.803000,0:00:13.013000
JPN,ENU,jpneng25134,TMU_0503132349_sorted_seg14.output.txt,1410,本文は，従来半導体工場に３系統あった排気設備の統合作業紹介である。,2,2021-05-17 05:28:39.995000,2021-05-17 05:28:46.576000,0:00:06.581000
JPN,ENU,jpneng25116,TMU_0503132349_sorted_seg14.output.txt,1411,主目的は生産設備増設への対応と既存設備の稼働率向上にある。,39,2021-05-17 06:28:22.689000,2021-05-17 06:28:28.589000,0:00:05.900000
JPN,ENU,jpneng2512c,TMU_0503132349_sorted_seg14.output.txt,1412,統合後はエピ成長装置の排気だけがＨＣｌスクラバーを通り，その他は新設した吸込チャンバーへ直接流れ込む。,83,2021-05-15 21:38:50.001000,2021-05-15 21:39:29.241000,0:00:39.240000
JPN,ENU,jpneng25115,TMU_0503132349_sorted_seg14.output.txt,1413,最終段のエピ系スクラバーが排気を大気中に放出する。,12,2021-05-19 05:15:40.746000,2021-05-19 05:16:02.746000,0:00:22
JPN,ENU,jpneng25104,TMU_0503132349_sorted_seg14.output.txt,1414,濃度は検出限界２ｐｐｍ以下であり，環境基準を満たしている,75,2021-05-13 23:25:09.957000,2021-05-13 23:25:22.024000,0:00:12.067000
JPN,ENU,jpneng25129,TMU_0503132349_sorted_seg14.output.txt,1415,本文は標記問題の解説記事である。,66,2021-05-16 12:31:52.994000,2021-05-16 12:32:19.382000,0:00:26.388000
JPN,ENU,jpneng25123,TMU_0503132349_sorted_seg14.output.txt,1416,本文ではまずＥＳＤ（静電気放電）など用語の定義を解説した。,60,2021-05-19 22:49:16.477000,2021-05-19 22:49:22.792000,0:00:06.315000
JPN,ENU,jpneng2510a,TMU_0503132349_sorted_seg14.output.txt,1417,次にＩＣ破壊と帯電経路を分類し，人体でも３５ｋＶの帯電が起ることを表で示した。,69,2021-05-18 23:39:20.559000,2021-05-18 23:39:30.979000,0:00:10.420000
JPN,ENU,jpneng25108,TMU_0503132349_sorted_seg14.output.txt,1418,対策としては導電性のテーブルマットとフロアマット，リストストラップを挙げ，人体の静電容量も表で示した。,64,2021-05-14 15:35:32.941000,2021-05-14 15:35:42.437000,0:00:09.496000
JPN,ENU,jpneng2512d,TMU_0503132349_sorted_seg14.output.txt,1419,実際に作業者が着るリストストラップについては，静電電圧の時間変化をグラフで示した,51,2021-05-19 02:09:50.850000,2021-05-19 02:10:03.468000,0:00:12.618000
JPN,ENU,jpneng25149,TMU_0503132349_sorted_seg14.output.txt,1420,ダイヤモンドのヒートシンクとしての特性及び応用について述べた。,54,2021-05-17 06:22:56.891000,2021-05-17 06:23:04.690000,0:00:07.799000
JPN,ENU,jpneng25127,TMU_0503132349_sorted_seg14.output.txt,1421,ダイヤモンドの熱伝導率，熱膨張率及び電気特性をその外の材料と比較して示した。,2,2021-05-14 18:52:07.963000,2021-05-14 18:52:15.809000,0:00:07.846000
JPN,ENU,jpneng25146,TMU_0503132349_sorted_seg14.output.txt,1422,ヒートシンク用としては，高純度ダイヤモンド合成が必要であり，大面積で低コストを考えると気相法ダイヤモンドが適している。,5,2021-05-16 18:44:48.760000,2021-05-16 18:45:41.537000,0:00:52.777000
JPN,ENU,jpneng25125,TMU_0503132349_sorted_seg14.output.txt,1423,光通信用及びデバイス用ヒートシンクとしてのダイヤモンドについて，その現状と将来を概説した,38,2021-05-15 05:46:55.386000,2021-05-15 05:47:08.987000,0:00:13.601000
JPN,ENU,jpneng25123,TMU_0503132349_sorted_seg14.output.txt,1424,ラックス創業７０周年記念の一環として開発した標記のアンプは，ラジオ技術誌のベストステレオコンポグランプリの金賞受賞をはじめ，著名オーディオ誌で高い評価を得た。,71,2021-05-19 22:40:07.169000,2021-05-19 22:40:26.482000,0:00:19.313000
JPN,ENU,jpneng25114,TMU_0503132349_sorted_seg14.output.txt,1425,本機の企画意図，ＢＴＬ方式で５００Ｗ／８Ω仕様に決定するまでの経緯など述べた。,4,2021-05-15 16:30:50.112000,2021-05-15 16:31:03.153000,0:00:13.041000
JPN,ENU,jpneng25140,TMU_0503132349_sorted_seg14.output.txt,1426,バランス伝送のメリットや入力回路とアッテネータを解説し，初段をＦＥＴにしたツインハイブリッドダイヤモンドバッファ回路の特徴を述べた。,3,2021-05-16 03:33:24.954000,2021-05-16 03:33:33.537000,0:00:08.583000
JPN,ENU,jpneng2510d,TMU_0503132349_sorted_seg14.output.txt,1427,更にスピーカをＢＴＬ駆動するバランスＣＳＳＣ（相補型単一スタガ回路）と名付けたバランス増幅回路，バランスＣＳＳＣに施したＯＤβ（最適化デュアルＮＦＢ）と称する多重電流帰還の仕組みを解説した。,27,2021-05-14 16:42:40.546000,2021-05-14 16:42:57.463000,0:00:16.917000
JPN,ENU,jpneng2510b,TMU_0503132349_sorted_seg14.output.txt,1428,銅管入り銅箔スチロールコンデンサなどのカスタムパーツの採用，ハイイナーシャ電源，ＢＴＬ出力段の給電方式などを述べた,26,2021-05-17 02:46:56.288000,2021-05-17 02:47:03.839000,0:00:07.551000
JPN,ENU,jpneng25126,TMU_0503132349_sorted_seg14.output.txt,1429,首記製造技術の穴明けについて解説した。,51,2021-05-17 19:33:48.751000,2021-05-17 19:34:01.996000,0:00:13.245000
JPN,ENU,jpneng25110,TMU_0503132349_sorted_seg14.output.txt,1430,エキシマレーザ，炭酸ガスレーザ，Ｎｄ：ＹＡＧレーザのそれぞれのシステム概要と加工精度などの特徴を説明した。,51,2021-05-14 19:10:22.903000,2021-05-14 19:10:29.718000,0:00:06.815000
JPN,ENU,jpneng25120,TMU_0503132349_sorted_seg14.output.txt,1431,レーザによる適度なテーパをもつビルドアップバイアの形状，工程，品質，適用事例と問題点などを論じた。,20,2021-05-14 05:33:23.092000,2021-05-14 05:34:09.150000,0:00:46.058000
JPN,ENU,jpneng25126,TMU_0503132349_sorted_seg14.output.txt,1432,感光性樹脂を使用した光による穴明け，アルカリ，酸などの化学的なエッチング法を交え紹介した,76,2021-05-17 19:34:28.215000,2021-05-17 19:34:39.255000,0:00:11.040000
JPN,ENU,jpneng25101,TMU_0503132349_sorted_seg14.output.txt,1433,チップの一つの面に第１の放熱板を設け，他の面に第２の放熱板を設ける。,38,2021-05-15 16:07:56.628000,2021-05-15 16:08:05.908000,0:00:09.280000
JPN,ENU,jpneng25143,TMU_0503132349_sorted_seg14.output.txt,1434,第２の放熱板はチップ表面側のモールドに接合する。,94,2021-05-17 16:25:12.264000,2021-05-17 16:25:17.693000,0:00:05.429000
JPN,ENU,jpneng2513b,TMU_0503132349_sorted_seg14.output.txt,1435,接合はフレームのアウターリードをカットする際に圧着して行う。,62,2021-05-18 14:37:24.518000,2021-05-18 14:37:39.161000,0:00:14.643000
JPN,ENU,jpneng2510d,TMU_0503132349_sorted_seg14.output.txt,1437,これにより，アセンブリ工程数を増やすことなくパッケージの反りを防ぐとともに，放熱効果を上げることができる,19,2021-05-14 20:39:47.680000,2021-05-14 20:40:07.015000,0:00:19.335000
JPN,ENU,jpneng25135,TMU_0503132349_sorted_seg14.output.txt,1438,入射光と電気信号の間の相関検出器を２次元に配列する新しい形式のイメージセンサを提案した。,2,2021-05-15 16:04:30.586000,2021-05-15 16:04:47.759000,0:00:17.173000
JPN,ENU,jpneng2513b,TMU_0503132349_sorted_seg14.output.txt,1439,この構造の特徴は，１）入射フォトンを光電流（被乗数）に変換するフォトダイオード検出器，２）全画素に共通な外部電気信号入力（乗数），３）光電流と電気信号の積を生成する電流モード乗算器，４）積電流を積分して相関結果を蓄積するコンデンサ，５）相関結果を通常のビデオ信号として走査するＣＣＤまたはＭＯＳスイッチ回路，にある。,61,2021-05-18 14:34:40.492000,2021-05-18 14:34:45.761000,0:00:05.269000
JPN,ENU,jpneng25118,TMU_0503132349_sorted_seg14.output.txt,1440,いくつかの可能な構造と回路を提案し検証した。,51,2021-05-13 21:20:00.517000,2021-05-13 21:20:08.137000,0:00:07.620000
JPN,ENU,jpneng2510f,TMU_0503132349_sorted_seg14.output.txt,1441,また，このセンサの応用について検討した,87,2021-05-14 00:59:39.020000,2021-05-14 01:00:23.130000,0:00:44.110000
JPN,ENU,jpneng25107,TMU_0503132349_sorted_seg14.output.txt,1442,大画面壁掛テレビへの可能性に注目しつつ，ＰＤＰを用いた標記技術を解説した。,64,2021-05-15 06:33:01.265000,2021-05-15 06:33:10.469000,0:00:09.204000
JPN,ENU,jpneng25111,TMU_0503132349_sorted_seg14.output.txt,1443,テレビ表示への基本的前提となるＰＤＰのメモリ機能を先ず解説した。,56,2021-05-14 23:21:11.583000,2021-05-14 23:21:22.157000,0:00:10.574000
JPN,ENU,jpneng25121,TMU_0503132349_sorted_seg14.output.txt,1444,次いでテレビ表示方法として，表示の原理とＤＣ型及びＡＣ型表示方式を解説した。,51,2021-05-15 05:06:56.941000,2021-05-15 05:07:14.933000,0:00:17.992000
JPN,ENU,jpneng25135,TMU_0503132349_sorted_seg14.output.txt,1445,さらに表示システムの角度から解説した後，動画像劣化とその対策も説明した。,42,2021-05-15 15:54:46.945000,2021-05-15 15:55:05.420000,0:00:18.475000
JPN,ENU,jpneng25118,TMU_0503132349_sorted_seg14.output.txt,1446,通信架収容の電子回路基板に搭載のＤＣ‐ＤＣコンバータなど通信用オンボード電源の入力急変特性の評価装置について述べた。,76,2021-05-13 21:22:51.367000,2021-05-13 21:22:55.132000,0:00:03.765000
JPN,ENU,jpneng2513b,TMU_0503132349_sorted_seg14.output.txt,1447,ヒューズを挿入した時に発生する電圧変動を模擬する入力急変特性評価装置を構成した。,47,2021-05-18 09:26:14.135000,2021-05-18 09:26:33.922000,0:00:19.787000
JPN,ENU,jpneng25124,TMU_0503132349_sorted_seg14.output.txt,1448,実際の入力急変電圧波形をデータベース化し，ＤＡコンバータを通してＤＣアンプに出力して，任意波形の入力急変を可能にした。,76,2021-05-13 23:14:06.661000,2021-05-13 23:14:10.313000,0:00:03.652000
JPN,ENU,jpneng2512c,TMU_0503132349_sorted_seg14.output.txt,1449,正弦波半周期をオンボード電源に印加した動作確認の結果，目標通りの動作が得られることを確認した。,68,2021-05-15 22:01:34.914000,2021-05-15 22:01:38.959000,0:00:04.045000
JPN,ENU,jpneng25121,TMU_0503132349_sorted_seg14.output.txt,1450,電力系統の短絡事故箇所の除去のために発生する瞬時電圧低下の継続時間を，１サイクルに短縮する高速度真空遮断器を開発した。,60,2021-05-15 05:52:13.268000,2021-05-15 05:52:28.242000,0:00:14.974000
JPN,ENU,jpneng25118,TMU_0503132349_sorted_seg14.output.txt,1451,真空バルブ操作軸上の電磁反発コイルと引き外しコイルによる高速遮断機構を組み込んだ真空遮断器である。,76,2021-05-13 22:27:31.895000,2021-05-13 22:27:36.153000,0:00:04.258000
JPN,ENU,jpneng2514b,TMU_0503132349_sorted_seg14.output.txt,1452,検出時間は４ｍｓであった。,78,2021-05-17 07:42:09.282000,2021-05-17 07:42:13.333000,0:00:04.051000
JPN,ENU,jpneng25113,TMU_0503132349_sorted_seg14.output.txt,1453,解析では母線電圧６０％の低下事故を９６％まで回復できた。,37,2021-05-14 16:48:47.805000,2021-05-14 16:48:50.720000,0:00:02.915000
JPN,ENU,jpneng2512f,TMU_0503132349_sorted_seg14.output.txt,1454,キンセキ株式会社が開発した標記水晶製品を紹介した。,63,2021-05-19 01:39:10.564000,2021-05-19 01:39:15.589000,0:00:05.025000
JPN,ENU,jpneng25122,TMU_0503132349_sorted_seg14.output.txt,1455,形状的，コスト面仕様の標準化等から新製品ＣＸ‐１６Ｆの開発背景を説明した。,73,2021-05-17 23:46:02.260000,2021-05-17 23:46:09.113000,0:00:06.853000
JPN,ENU,jpneng2511d,TMU_0503132349_sorted_seg14.output.txt,1456,同製品は表面実装リードレスタイプの小形・薄形・低価格品であり，その外形寸法と内部構造を示した。,29,2021-05-19 07:47:06.952000,2021-05-19 07:47:27.911000,0:00:20.959000
JPN,ENU,jpneng25148,TMU_0503132349_sorted_seg14.output.txt,1457,同製品の標準周波数の決定，負荷容量，リフロソルダリング条件を述べた。,63,2021-05-17 12:09:09.291000,2021-05-17 12:09:44.095000,0:00:34.804000
JPN,ENU,jpneng2510d,TMU_0503132349_sorted_seg14.output.txt,1458,正と負の群速度分散を持つ光ファイバを交互に接続した伝送路を伝搬する準安定なＲＺ非線形パルスは分散マネージソリトン，分散アロケートソリトンあるいはストレッチパルスなどと呼ばれている。,28,2021-05-14 20:39:12.172000,2021-05-14 20:39:45.505000,0:00:33.333000
JPN,ENU,jpneng25144,TMU_0503132349_sorted_seg14.output.txt,1459,これらの非線形パルスは伝送方向に均一な以上分散性を持つファイバ中の通常の光ソリトンより優れた伝送特性を持つ可能性がある。,75,2021-05-16 23:19:38.080000,2021-05-16 23:19:44.030000,0:00:05.950000
JPN,ENU,jpneng25143,TMU_0503132349_sorted_seg14.output.txt,1460,周期的に群速度分散の符号が反転する伝送路におけるストレッチパルスの特性を明らかにし，さらにより実際的な伝送路におけるストレッチパルスの長距離伝搬特性を数値シミュレーションにとって明らかにした。,87,2021-05-17 16:01:25.201000,2021-05-17 16:01:54.277000,0:00:29.076000
JPN,ENU,jpneng2512e,TMU_0503132349_sorted_seg14.output.txt,1461,同じ長さに異常分散ファイバと正常分散ファイバが交互に接続された伝送路をモデルとして解析を行った。,45,2021-05-19 02:48:53.823000,2021-05-19 02:49:01.012000,0:00:07.189000
JPN,ENU,jpneng2513e,TMU_0503132349_sorted_seg14.output.txt,1462,ディジタル衛星放送技術の概要を紹介し，諸外国のディジタル衛星放送の現況を概観した。,59,2021-05-17 10:41:51.072000,2021-05-17 10:42:02.478000,0:00:11.406000
JPN,ENU,jpneng25140,TMU_0503132349_sorted_seg14.output.txt,1463,ディジタル衛星放送の技術では，情報圧縮のための情報の符号化，サービスの多重化，衛星伝送する方法，スクランブルなどの限定受信，Ｓｅｒｖｉｃｅ　Ｉｎｆｏｒｍａｔｉｏｎについて説明した。,11,2021-05-16 03:47:29.722000,2021-05-16 03:47:36.753000,0:00:07.031000
JPN,ENU,jpneng25108,TMU_0503132349_sorted_seg14.output.txt,1464,これらの技術により，多チャネル放送，有料放送の視聴契約，番組表の分類，全員と個人当ての連絡メールの伝送，双方向機能による視聴者参加番組などが可能になる。,69,2021-05-14 15:44:22.176000,2021-05-14 15:44:29.381000,0:00:07.205000
JPN,ENU,jpneng2513f,TMU_0503132349_sorted_seg14.output.txt,1466,Ｅｕｒｏｃｏｐｔｅｒ　ＥＣ１２０Ｂはフランス，ドイツ，中国の３社が共同開発した５人乗り軽単発タービンヘリコプタである。,35,2021-05-16 12:00:29.491000,2021-05-16 12:00:56.971000,0:00:27.480000
JPN,ENU,jpneng25104,TMU_0503132349_sorted_seg14.output.txt,1467,搭載エンジンはＴｕｒｂｏ‐Ｍｅｃｈａ社（フランス）製のＡｒｒｉｕｓ２Ｆターボシャフトエンジンである。,75,2021-05-13 23:18:31.417000,2021-05-13 23:18:55.521000,0:00:24.104000
JPN,ENU,jpneng25126,TMU_0503132349_sorted_seg14.output.txt,1468,本文では，次項により本エンジンの概要を紹介した。,99,2021-05-17 19:32:37.615000,2021-05-17 19:32:59.169000,0:00:21.554000
JPN,ENU,jpneng2510b,TMU_0503132349_sorted_seg14.output.txt,1469,１）一般（フリータービン方式，３７６ｋＷ／５０４ｓｈｐ／６０００ｒｐｍ，１０３ｋｇ，減速ギアボックス・ガス発生機・パワータービン・排気管），２）構造（減速ギアボックス，ガス発生機），３）オイルシステム，４）エアシステム，５）フューエルシステム，６）制御系，７）インジケーションシステム，８）エンジンマウント。,50,2021-05-17 02:41:35.709000,2021-05-17 02:41:46.291000,0:00:10.582000
JPN,ENU,jpneng2513b,TMU_0503132349_sorted_seg14.output.txt,1470,ガソリンエンジンの出荷は，６１７３０００台で，前年とほとんど同じになっている。,55,2021-05-18 14:36:27.287000,2021-05-18 14:36:38.751000,0:00:11.464000
JPN,ENU,jpneng2512e,TMU_0503132349_sorted_seg14.output.txt,1471,自家用，ＯＥＭ向け，単体輸出のシェアは，それぞれ，３８．０％，３７．７％及び２３．２％である。,28,2021-05-19 03:28:36.909000,2021-05-19 03:28:52.049000,0:00:15.140000
JPN,ENU,jpneng25117,TMU_0503132349_sorted_seg14.output.txt,1472,数量では国内向けは，ほぼ前年なみですが，輸出は単体輸出が伸び，自家用，ＯＥＭ経由は減っている。,2,2021-05-18 03:18:41.852000,2021-05-18 03:18:50.028000,0:00:08.176000
JPN,ENU,jpneng25107,TMU_0503132349_sorted_seg14.output.txt,1473,またガソリンエンジンの農林漁業機械部門への出荷は，３３５２０００台で５４．３％のシェアを占めている,72,2021-05-15 06:28:38.199000,2021-05-15 06:28:51.374000,0:00:13.175000
