Source,Target,User,System,SegmentID,Segment,Score,Start,End,Delta
JPN,ENU,jpneng25122,TMU_0503132349_sorted_seg14.output.txt,877,肝臓は消化器系臓器からの門脈血流が最初に流入する臓器であり，消化器癌の転移頻度が最も高い臓器である。,65,2021-05-17 23:36:28.096000,2021-05-17 23:37:00.909000,0:00:32.813000
JPN,ENU,jpneng25137,TMU_0503132349_sorted_seg14.output.txt,878,本稿では大腸癌を中心に転移性肝癌に対する各治療法について概説した。,44,2021-05-16 10:21:13.925000,2021-05-16 10:21:25.159000,0:00:11.234000
JPN,ENU,jpneng25131,TMU_0503132349_sorted_seg14.output.txt,879,最初に肝転移の評価法及び肝外病変の検索法について述べた。,25,2021-05-14 17:40:13.743000,2021-05-14 17:40:19.403000,0:00:05.660000
JPN,ENU,jpneng2512a,TMU_0503132349_sorted_seg14.output.txt,880,次いで大腸癌肝転移の疫学について述べ，大腸癌の肝転移に関し，手術療法，動注化学療法，局所療法，全身化学療法について述べた。,80,2021-05-15 10:57:07.787000,2021-05-15 10:57:17.836000,0:00:10.049000
JPN,ENU,jpneng25116,TMU_0503132349_sorted_seg14.output.txt,881,最後に神経内分泌腫瘍の肝転移についての治療法について述べた。,35,2021-05-17 04:12:30.161000,2021-05-17 04:12:50.797000,0:00:20.636000
JPN,ENU,jpneng25136,TMU_0503132349_sorted_seg14.output.txt,882,５４歳の女性のｃｕｔａｎｅｏｕｓ　ｆｏｃａｌ　ｍｕｃｉｎｏｓｉｓに関する症例を報告した。,67,2021-05-16 08:44:43.872000,2021-05-16 08:44:49.424000,0:00:05.552000
JPN,ENU,jpneng2513d,TMU_0503132349_sorted_seg14.output.txt,883,２年前から左大陰唇に径１０ｍｍ大の淡紅色で光沢のある結節が出現し，徐々に拡大した。,81,2021-05-19 04:11:21.473000,2021-05-19 04:11:27.619000,0:00:06.146000
JPN,ENU,jpneng25120,TMU_0503132349_sorted_seg14.output.txt,884,２ｍｍ離して単純切除した。,4,2021-05-14 05:31:16.510000,2021-05-14 05:31:21.492000,0:00:04.982000
JPN,ENU,jpneng25129,TMU_0503132349_sorted_seg14.output.txt,885,病理組織学的所見よりｃｕｔａｎｅｏｕｓ　ｆｏｃａｌ　ｍｕｃｉｎｏｓｉｓと診断した。,88,2021-05-15 18:00:03.544000,2021-05-15 18:02:09.839000,0:02:06.295000
JPN,ENU,jpneng25111,TMU_0503132349_sorted_seg14.output.txt,886,術後５カ月間，再発はない。,10,2021-05-14 23:44:43.989000,2021-05-14 23:44:51.425000,0:00:07.436000
JPN,ENU,jpneng2513c,TMU_0503132349_sorted_seg14.output.txt,888,Ｔ３投与後の血中Ｔ４／Ｔ３投与前の血中Ｔ４＜６０％を緩解の指標にした。,66,2021-05-17 08:36:26.351000,2021-05-17 08:36:30.194000,0:00:03.843000
JPN,ENU,jpneng25101,TMU_0503132349_sorted_seg14.output.txt,889,この指標を目安にすると，バセドウ病再発は抗甲状腺剤中止直後１年間は認められず，５年間で１４６例中１６例で再発を認めたにすぎなかった。,43,2021-05-15 16:03:24.822000,2021-05-15 16:03:31.792000,0:00:06.970000
JPN,ENU,jpneng25111,TMU_0503132349_sorted_seg14.output.txt,890,その再発率は１１％で，他の報告に比べて極めて優れていた,71,2021-05-15 00:15:01.266000,2021-05-15 00:15:06.449000,0:00:05.183000
JPN,ENU,jpneng2514a,TMU_0503132349_sorted_seg14.output.txt,891,同様の寒冷刺激試験を行ったにもかかわらず，月経周期によって異なる結果を示した１７歳の女子例を報告した。,3,2021-05-18 01:00:16.245000,2021-05-18 01:00:22.429000,0:00:06.184000
JPN,ENU,jpneng25120,TMU_0503132349_sorted_seg14.output.txt,892,月経開始２週間前，６日前，６日後に寒冷刺激試験を続けて行い，負荷前後の血しょう中ヒスタミン値，尿中Ｎ‐メチルヒスタミン値（ＮＭＨ）を求めた。,38,2021-05-14 07:20:48.049000,2021-05-14 07:21:03.546000,0:00:15.497000
JPN,ENU,jpneng25122,TMU_0503132349_sorted_seg14.output.txt,893,また，月経による性ホルモンの変化についても測定した。,62,2021-05-17 23:13:52.824000,2021-05-17 23:13:59.079000,0:00:06.255000
JPN,ENU,jpneng25111,TMU_0503132349_sorted_seg14.output.txt,894,尿中ＮＭＨの測定は寒冷じん麻疹の診断に有用と考えた,34,2021-05-14 23:51:40.004000,2021-05-14 23:51:49.896000,0:00:09.892000
JPN,ENU,jpneng25106,TMU_0503132349_sorted_seg14.output.txt,895,米国では骨盤位の帝切率が１９８０年代に８０‐９０％と飛躍的に増加し，現在もほぼそのままの率を維持している。,48,2021-05-14 20:30:20.246000,2021-05-14 20:30:54.823000,0:00:34.577000
JPN,ENU,jpneng2510a,TMU_0503132349_sorted_seg14.output.txt,896,外回転術は３７週に通常行なわれる。,74,2021-05-18 23:31:19.702000,2021-05-18 23:31:26.282000,0:00:06.580000
JPN,ENU,jpneng2511b,TMU_0503132349_sorted_seg14.output.txt,897,外回転術が不成功に終わった症例に骨盤撮影を行なう。,47,2021-05-18 02:41:53.757000,2021-05-18 02:42:06.472000,0:00:12.715000
JPN,ENU,jpneng25105,TMU_0503132349_sorted_seg14.output.txt,898,経ちつ分娩の条件を満たした症例には試験分娩を試みるが，何か問題があると変更されることが多く，今後も帝切率が下がる状況にない,36,2021-05-14 10:25:31.290000,2021-05-14 10:25:52.706000,0:00:21.416000
JPN,ENU,jpneng25143,TMU_0503132349_sorted_seg14.output.txt,899,くも膜下血術後，小脳梗塞，両側性麻ひとなった４９歳，女性の患者の看護を経験した。,62,2021-05-17 16:31:32.068000,2021-05-17 16:31:41.576000,0:00:09.508000
JPN,ENU,jpneng2510a,TMU_0503132349_sorted_seg14.output.txt,900,危険の防止と異常の早期発見，ＡＤＬ（日常生活動作）の拡大と自立を看護目標として，自助具などについても工夫した。,69,2021-05-18 23:46:20.467000,2021-05-18 23:46:36.767000,0:00:16.300000
JPN,ENU,jpneng2510c,TMU_0503132349_sorted_seg14.output.txt,901,その結果，完全自立となりＡＤＬはないが，入院時と比較し，かなり進歩が見られた。,51,2021-05-16 13:43:15.573000,2021-05-16 13:43:23.423000,0:00:07.850000
JPN,ENU,jpneng25107,TMU_0503132349_sorted_seg14.output.txt,902,食事については，全介助から半介助となった。,64,2021-05-15 06:31:43.467000,2021-05-15 06:31:52.690000,0:00:09.223000
JPN,ENU,jpneng2511d,TMU_0503132349_sorted_seg14.output.txt,903,排せつ，排尿はまだ時間を要する,25,2021-05-19 08:01:53.535000,2021-05-19 08:02:11.432000,0:00:17.897000
JPN,ENU,jpneng2513c,TMU_0503132349_sorted_seg14.output.txt,904,高血圧のためトリクロルサイアザイド（Ｉ）を１日１２ｍｇ投与されていた７８歳女性症例で，体動時回転性めまい治療のため炭酸水素Ｎａ製剤静注中に突然意識が消失した。,68,2021-05-17 06:12:16.494000,2021-05-17 06:12:59.322000,0:00:42.828000
JPN,ENU,jpneng25140,TMU_0503132349_sorted_seg14.output.txt,905,本例はＩの過剰投与により低Ｋ血症などの電解質異常をきたし，洞性徐脈，心房細動，完全左脚ブロック，上室性・心室性期外収縮，など多彩な不整脈を生じるにいたったと考えた。,9,2021-05-16 03:39:00.876000,2021-05-16 03:39:11.305000,0:00:10.429000
JPN,ENU,jpneng2510d,TMU_0503132349_sorted_seg14.output.txt,906,Ｋ補充療法のみでは不十分で，人工ペースメーカー療法が有効であった。,20,2021-05-14 20:42:43.419000,2021-05-14 20:42:55.820000,0:00:12.401000
JPN,ENU,jpneng25114,TMU_0503132349_sorted_seg14.output.txt,907,多彩な心室性不整脈発生機序としてトリガー活性の関与を考えた,18,2021-05-15 17:19:48.125000,2021-05-15 17:20:09.676000,0:00:21.551000
JPN,ENU,jpneng25138,TMU_0503132349_sorted_seg14.output.txt,908,標記集団下痢症の概要を報告した。,18,2021-05-15 19:47:22.064000,2021-05-15 19:47:30.230000,0:00:08.166000
JPN,ENU,jpneng25101,TMU_0503132349_sorted_seg14.output.txt,909,園児ら９９名を対象に採取した便についてＰＣＲを行った結果，３名から標記大腸菌を検出した。,31,2021-05-15 15:09:44.547000,2021-05-15 15:09:58.081000,0:00:13.534000
JPN,ENU,jpneng2511d,TMU_0503132349_sorted_seg14.output.txt,910,また関係者１５５名，のべ５７９検体から標記毒素産生性，１６株を分離した。,37,2021-05-19 07:22:56.397000,2021-05-19 07:23:19.024000,0:00:22.627000
JPN,ENU,jpneng25106,TMU_0503132349_sorted_seg14.output.txt,911,給排水に問題はなく，原因食品も不明だが，消毒薬の未設置，汚物処理用流しとおむつ保管ケースともに園児が触れることが可能であった等，関係事項としてあげた,24,2021-05-14 20:19:33.575000,2021-05-14 20:20:00.804000,0:00:27.229000
JPN,ENU,jpneng25134,TMU_0503132349_sorted_seg14.output.txt,912,脊椎分離症の大部分は発育期の過激なスポーツ活動などが原因となることが明らかとなった。,1,2021-05-17 05:14:56.940000,2021-05-17 05:15:03.814000,0:00:06.874000
JPN,ENU,jpneng25136,TMU_0503132349_sorted_seg14.output.txt,913,脊椎分離症の診断はＭＲＩによりＸ線診断より早期に診断が可能となり，保存療法による治療成績を著しく高めている。,79,2021-05-16 08:15:12.514000,2021-05-16 08:15:21.353000,0:00:08.839000
JPN,ENU,jpneng25114,TMU_0503132349_sorted_seg14.output.txt,914,中学校検診にて腰痛を訴えた者にＭＲＩを実施したところ５１％に低輝度変化を認めた。,13,2021-05-15 16:48:40.204000,2021-05-15 16:48:53.186000,0:00:12.982000
JPN,ENU,jpneng2511e,TMU_0503132349_sorted_seg14.output.txt,915,これらは腰椎装具装用または運動制限により全症例軽快した。,4,2021-05-18 02:01:07.672000,2021-05-18 02:01:26.053000,0:00:18.381000
JPN,ENU,jpneng25128,TMU_0503132349_sorted_seg14.output.txt,916,中学生で明らかな原因がなく１か月以上腰痛が続く時はＭＲＩ診断を推奨する,36,2021-05-19 22:48:36.743000,2021-05-19 22:48:44.699000,0:00:07.956000
JPN,ENU,jpneng2512e,TMU_0503132349_sorted_seg14.output.txt,917,近年，胆石特有の症状を有さない“無症状胆石”が多く認められる。,50,2021-05-19 03:23:08.769000,2021-05-19 03:23:15.965000,0:00:07.196000
JPN,ENU,jpneng25138,TMU_0503132349_sorted_seg14.output.txt,918,存在部位は，９５％以上が隙嚢結石であるといわれているが，総胆管結石症や肝内結石症でも無症状で発見されることもある。,53,2021-05-15 19:37:51.727000,2021-05-15 19:38:02.506000,0:00:10.779000
JPN,ENU,jpneng2512a,TMU_0503132349_sorted_seg14.output.txt,919,無症状胆石の治療の基本方針は経過観察である。,73,2021-05-15 12:46:47.776000,2021-05-15 12:47:31.573000,0:00:43.797000
JPN,ENU,jpneng2512b,TMU_0503132349_sorted_seg14.output.txt,921,痛風の診断は，持続性の高尿酸血症が存在し，急性関節炎発作の際に関節液中に尿酸ソーダの針状結晶が析出し，多核白血球がこれをどん食していることを認めると確診できる。,85,2021-05-16 05:10:25.149000,2021-05-16 05:10:35.788000,0:00:10.639000
JPN,ENU,jpneng25132,TMU_0503132349_sorted_seg14.output.txt,922,慢性関節リウマチ，偽痛風との鑑別が必要である。,49,2021-05-14 10:50:54.383000,2021-05-14 10:51:13.467000,0:00:19.084000
JPN,ENU,jpneng2510b,TMU_0503132349_sorted_seg14.output.txt,923,また尿酸クリアランス試験により病型診断を行う。,37,2021-05-17 03:07:20.435000,2021-05-17 03:07:27.340000,0:00:06.905000
JPN,ENU,jpneng25107,TMU_0503132349_sorted_seg14.output.txt,924,その他，合併症診断や治療ならびに経過観察に必要な検査についても述べた,98,2021-05-15 07:03:50.877000,2021-05-15 07:04:03.913000,0:00:13.036000
JPN,ENU,jpneng2512d,TMU_0503132349_sorted_seg14.output.txt,925,現在日本で使用可能なＨ２遮断薬（Ｉ），プロトンポンプ阻害薬（ＩＩ）の１日１回投与を解説した。,25,2021-05-19 02:33:07.814000,2021-05-19 02:33:17.143000,0:00:09.329000
JPN,ENU,jpneng25139,TMU_0503132349_sorted_seg14.output.txt,926,Ｉの主なものにシメチジン，ラニチジン，ファモチジンなどがあり，１日１回投与と２回投与で治癒率に差を認めない。,99,2021-05-15 19:02:00.432000,2021-05-15 19:02:11.322000,0:00:10.890000
JPN,ENU,jpneng25143,TMU_0503132349_sorted_seg14.output.txt,927,投与時間はファモチジンでは朝１回投与が優れていた。,15,2021-05-17 15:50:37.413000,2021-05-17 15:50:47.971000,0:00:10.558000
JPN,ENU,jpneng25110,TMU_0503132349_sorted_seg14.output.txt,928,ＩＩにはオメプラゾールとランソプラゾールがあり，時投時間による治癒率の差は認めなかった,65,2021-05-14 19:13:57.615000,2021-05-14 19:14:09.912000,0:00:12.297000
JPN,ENU,jpneng25136,TMU_0503132349_sorted_seg14.output.txt,929,中等度以上の高血圧を合併する脳血管障害患者２０例に対してリシノプリル（１０ｍｇ）を朝１回投与し，４〜８週後に血圧日内変動の観点からその有用性を検討した。,73,2021-05-16 08:24:43.625000,2021-05-16 08:24:49.733000,0:00:06.108000
JPN,ENU,jpneng2512a,TMU_0503132349_sorted_seg14.output.txt,930,日中夜間とも均等の血圧下降が見られ，日内変動を変化させずに降圧が行われた。,25,2021-05-15 13:08:12.068000,2021-05-15 13:08:26.573000,0:00:14.505000
JPN,ENU,jpneng2511e,TMU_0503132349_sorted_seg14.output.txt,932,本症例は投与１年後の追跡調査でも神経症状の悪化例は見られず，良好に経過している,13,2021-05-18 01:40:49.808000,2021-05-18 01:42:06.835000,0:01:17.027000
JPN,ENU,jpneng25129,TMU_0503132349_sorted_seg14.output.txt,933,多施設共同で脳卒中患者１５８例を対象とし，標記薬剤の自覚症状，精神症候，神経症候に対する作用と降圧効果を検討するため，オープン研究を行った。,59,2021-05-15 15:58:35.733000,2021-05-15 15:58:44.909000,0:00:09.176000
JPN,ENU,jpneng25106,TMU_0503132349_sorted_seg14.output.txt,934,脳卒中に随伴する自覚症状の改善，精神症候の改善に有効性を示した。,35,2021-05-14 21:10:35.750000,2021-05-14 21:10:51.844000,0:00:16.094000
JPN,ENU,jpneng25122,TMU_0503132349_sorted_seg14.output.txt,935,疾患別ではくも膜下出血で改善度が高かった。,44,2021-05-17 23:00:52.110000,2021-05-17 23:03:31.393000,0:02:39.283000
JPN,ENU,jpneng25115,TMU_0503132349_sorted_seg14.output.txt,936,急激な血圧低下は示さず，特に境界域血圧に対して，緩徐でしかも確実な降圧効果が示された,27,2021-05-19 06:13:40.434000,2021-05-19 06:13:53.879000,0:00:13.445000
JPN,ENU,jpneng2511e,TMU_0503132349_sorted_seg14.output.txt,937,完全抗体を検出するために生理食塩水法，不完全抗体を検出するために酵素法，アルブミン法，間接抗グロブリン試験を行う。,2,2021-05-18 02:39:20.962000,2021-05-18 02:39:29.417000,0:00:08.455000
JPN,ENU,jpneng25129,TMU_0503132349_sorted_seg14.output.txt,938,各検査法における操作上の留意点，異常反応とその対応について概説した。,48,2021-05-16 12:33:53.942000,2021-05-16 12:33:55.662000,0:00:01.720000
JPN,ENU,jpneng2510a,TMU_0503132349_sorted_seg14.output.txt,939,不規則性抗体スクリーニングを標記試験前に実施することは不可欠である。,78,2021-05-18 23:26:43.997000,2021-05-18 23:26:50.380000,0:00:06.383000
JPN,ENU,jpneng25132,TMU_0503132349_sorted_seg14.output.txt,940,緊急輸血に対応した標記試験のマニュアルを明確にしておく必要がある,49,2021-05-14 10:55:43.046000,2021-05-14 10:55:50.171000,0:00:07.125000
JPN,ENU,jpneng25114,TMU_0503132349_sorted_seg14.output.txt,941,プラスチック以外の非金属製の義肢装具材料について論じた。,18,2021-05-15 15:49:12.663000,2021-05-15 15:49:23.986000,0:00:11.323000
JPN,ENU,jpneng25136,TMU_0503132349_sorted_seg14.output.txt,942,天然材料，人工材料のそれぞれの種類と性質の優劣を述べた。,39,2021-05-16 08:10:05.501000,2021-05-16 08:10:10.303000,0:00:04.802000
JPN,ENU,jpneng2513c,TMU_0503132349_sorted_seg14.output.txt,943,天然有機物は生物体材料であり，人工材料も天然材料を目標として，それに到達あるいは凌駕したものもある。,64,2021-05-17 06:25:18.011000,2021-05-17 06:25:34.538000,0:00:16.527000
JPN,ENU,jpneng25139,TMU_0503132349_sorted_seg14.output.txt,944,それらは人間生体に近い材料で，義肢装具材料への適切な活用が保証される必要のあることを述べた,51,2021-05-15 18:43:52.833000,2021-05-15 18:44:23.750000,0:00:30.917000
JPN,ENU,jpneng25134,TMU_0503132349_sorted_seg14.output.txt,945,２１２例（１９７０〜１９９３年）の発症は６０〜６９歳で最も多く，２０〜２９歳の女性が同年代の男性に比し多かった。,25,2021-05-17 05:40:16.834000,2021-05-17 05:40:24.974000,0:00:08.140000
JPN,ENU,jpneng25115,TMU_0503132349_sorted_seg14.output.txt,947,８３％は特別な治療なしで自然治癒していた。,29,2021-05-19 06:24:23.087000,2021-05-19 06:24:31.784000,0:00:08.697000
JPN,ENU,jpneng25106,TMU_0503132349_sorted_seg14.output.txt,948,全体の４２％がＳＨ基を含む薬剤の服用歴を有し，居住地による症例の分布差は認められなかった,70,2021-05-14 20:57:38.824000,2021-05-14 20:57:50.191000,0:00:11.367000
JPN,ENU,jpneng25130,TMU_0503132349_sorted_seg14.output.txt,949,バセドウ病に著明な高カルシウム血症を合併したまれな１症例（男，２５歳）を報告した。,76,2021-05-14 15:30:40.205000,2021-05-14 15:30:56.171000,0:00:15.966000
JPN,ENU,jpneng2514a,TMU_0503132349_sorted_seg14.output.txt,950,本症例は全身衰弱が著明で，血清カルシウム値１２．５ｍｇ／ｄｌ，カルシウムイオン３．１４ｍＥｑ／ｌと著しい高カルシウム血症を呈した。,3,2021-05-18 00:53:52.984000,2021-05-18 00:54:04.295000,0:00:11.311000
JPN,ENU,jpneng25102,TMU_0503132349_sorted_seg14.output.txt,951,大量の輸液によって著明な高カルシウム血症は数日以内に改善し，抗甲状腺剤投与によって血清カルシウム値は血中甲状腺ホルモンの正常化にともない正常化した。,57,2021-05-14 10:20:45.971000,2021-05-14 10:21:28.608000,0:00:42.637000
JPN,ENU,jpneng25116,TMU_0503132349_sorted_seg14.output.txt,952,増悪因子の検索と至適治療の重要性を強調した,35,2021-05-17 04:17:23.214000,2021-05-17 04:17:29.198000,0:00:05.984000
JPN,ENU,jpneng2513b,TMU_0503132349_sorted_seg14.output.txt,953,透析患者の低栄養に直接関連するエネルギーと蛋白質を中心とした栄養療法の指標について概説した。,50,2021-05-18 14:43:09.194000,2021-05-18 14:43:25.300000,0:00:16.106000
JPN,ENU,jpneng25137,TMU_0503132349_sorted_seg14.output.txt,954,栄養指標として主要なものは，生体内のエネルギー源（脂肪）と蛋白源（筋蛋白，内蔵蛋白）の測定である。,59,2021-05-16 10:22:58.792000,2021-05-16 10:23:06.557000,0:00:07.765000
JPN,ENU,jpneng25116,TMU_0503132349_sorted_seg14.output.txt,956,また，処方に基づいた適正な運動療法も欠かせないものであり，今後運動耐容能などの指標も必要となるであろう,40,2021-05-17 04:39:46.105000,2021-05-17 04:39:52.500000,0:00:06.395000
JPN,ENU,jpneng25128,TMU_0503132349_sorted_seg14.output.txt,957,呼吸器の感染防御機構，慢性気道感染症の治療を図と表に示し，慢性気道感染症の病態と治療の原則について簡単に解説した。,52,2021-05-19 21:16:51.416000,2021-05-19 21:17:08.202000,0:00:16.786000
JPN,ENU,jpneng25148,TMU_0503132349_sorted_seg14.output.txt,958,次に，代表的な病原細菌を表にまとめ，その特徴を述べ，抗菌薬療法を病原菌別に記述した。,44,2021-05-17 12:17:41.293000,2021-05-17 12:18:48.697000,0:01:07.404000
JPN,ENU,jpneng2514b,TMU_0503132349_sorted_seg14.output.txt,959,さらに，外来もしくは在宅治療における注意点を示した。,36,2021-05-17 07:20:31.141000,2021-05-17 07:20:38.136000,0:00:06.995000
JPN,ENU,jpneng25132,TMU_0503132349_sorted_seg14.output.txt,960,最後に，慢性気道感染症に対するマクロライド少量長期療法の意義について紹介した,63,2021-05-14 10:33:43.397000,2021-05-14 10:33:57.669000,0:00:14.272000
JPN,ENU,jpneng25111,TMU_0503132349_sorted_seg14.output.txt,961,中枢性けいれんと脳内ヒスタミンレベルとの関係を解体した研究を説明した。,63,2021-05-15 00:12:23.625000,2021-05-15 00:12:33.530000,0:00:09.905000
JPN,ENU,jpneng25108,TMU_0503132349_sorted_seg14.output.txt,962,脳内ヒスタミンレベルと間代性けいれん持続時間との間には逆相関があり，強直性けいれん持続時間との間には相関はなかった。,31,2021-05-14 15:30:27.138000,2021-05-14 15:30:35.195000,0:00:08.057000
JPN,ENU,jpneng25104,TMU_0503132349_sorted_seg14.output.txt,963,ヒスタミンニューロン機構は間代性けいれん誘発持続時間の阻害に重要な役割を示した。,74,2021-05-13 23:35:42.817000,2021-05-13 23:35:51.601000,0:00:08.784000
JPN,ENU,jpneng25117,TMU_0503132349_sorted_seg14.output.txt,964,中枢作用性のＨ１受容体きっ抗薬は小児には投与すべきでない,14,2021-05-18 02:19:58.712000,2021-05-18 02:20:11.824000,0:00:13.112000
JPN,ENU,jpneng25129,TMU_0503132349_sorted_seg14.output.txt,965,切開排膿後の感染性粉りゅう，せつなどの感染症を伴う皮膚小潰よう１２例に対して，白糖・ポビドンヨード配合軟膏ユーパスタを潰よう内に挿入するタンポン法で使用し，その臨床的有用性を検討した。,54,2021-05-15 15:58:02.715000,2021-05-15 15:58:34.790000,0:00:32.075000
JPN,ENU,jpneng25135,TMU_0503132349_sorted_seg14.output.txt,966,潰ようの大きさ，深さは，ともに有意に縮小した。,3,2021-05-15 16:31:21.208000,2021-05-15 16:31:28.103000,0:00:06.895000
JPN,ENU,jpneng2513f,TMU_0503132349_sorted_seg14.output.txt,967,症状別改善度では，肉芽形成，表皮形成などすべての項目で１００％であった。,32,2021-05-16 15:11:02.757000,2021-05-16 15:11:20.387000,0:00:17.630000
JPN,ENU,jpneng2510a,TMU_0503132349_sorted_seg14.output.txt,969,副作用はまったく認められなかった,76,2021-05-18 23:41:37.936000,2021-05-18 23:41:42.149000,0:00:04.213000
JPN,ENU,jpneng25145,TMU_0503132349_sorted_seg14.output.txt,970,臨床分離７３株を対象とした。,26,2021-05-17 04:30:43.730000,2021-05-17 04:31:07.240000,0:00:23.510000
JPN,ENU,jpneng2510e,TMU_0503132349_sorted_seg14.output.txt,971,本キットの成績とメチシリンのＭＩＣ値との相関は良好であったが，メチシリン感受性であった４０株中１株でｍｅｃＡ遺伝子陽性となった。,43,2021-05-14 08:55:40.121000,2021-05-14 08:55:44.861000,0:00:04.740000
JPN,ENU,jpneng2511f,TMU_0503132349_sorted_seg14.output.txt,972,検出感度は，ＤＮＡを用いた場合と比較して，菌体を用いた場合には必ずしも十分でなかった。,0,2021-05-15 06:06:01.901000,2021-05-15 06:06:05.733000,0:00:03.832000
JPN,ENU,jpneng2510c,TMU_0503132349_sorted_seg14.output.txt,973,検出系の同時再現性では，電気泳動の方が安定していた。,51,2021-05-16 11:59:51.656000,2021-05-16 12:00:44.035000,0:00:52.379000
JPN,ENU,jpneng2513d,TMU_0503132349_sorted_seg14.output.txt,974,反応温度により差を認め，日差再現性にも大きなばらつきを認めた,50,2021-05-19 04:05:00.774000,2021-05-19 04:05:16.635000,0:00:15.861000
JPN,ENU,jpneng25116,TMU_0503132349_sorted_seg14.output.txt,975,一般用医薬品の法規上の特性について述べた。,40,2021-05-17 04:26:36.120000,2021-05-17 04:26:41.400000,0:00:05.280000
JPN,ENU,jpneng25149,TMU_0503132349_sorted_seg14.output.txt,976,つぎに，薬を使う薬学の必要性や，薬局薬剤師のための臨床薬学の点から，一般用医薬品の取扱い方について述べた。,74,2021-05-17 05:47:11.412000,2021-05-17 05:48:49.695000,0:01:38.283000
JPN,ENU,jpneng25114,TMU_0503132349_sorted_seg14.output.txt,977,さらに，地域の薬局薬剤師における「臨床薬学」の具体的な展開について考えた。,11,2021-05-15 16:43:56.066000,2021-05-15 16:44:07.508000,0:00:11.442000
JPN,ENU,jpneng25133,TMU_0503132349_sorted_seg14.output.txt,978,最後に，薬局医療学のための薬剤師教育のあり方について述べた,78,2021-05-15 03:50:21.382000,2021-05-15 03:50:26.817000,0:00:05.435000
JPN,ENU,jpneng2513d,TMU_0503132349_sorted_seg14.output.txt,979,症例は５８歳女性，進行性に歩行時ふらつき，排尿障害，痴呆を呈した。,62,2021-05-19 04:01:44.737000,2021-05-19 04:01:55.293000,0:00:10.556000
JPN,ENU,jpneng25114,TMU_0503132349_sorted_seg14.output.txt,980,アシクロビルにより，一時的な改善がみられた。,11,2021-05-15 16:10:40.089000,2021-05-15 16:11:02.565000,0:00:22.476000
JPN,ENU,jpneng2512b,TMU_0503132349_sorted_seg14.output.txt,981,脳脊髄液検査で細胞・蛋白増多，単純ほう疹ウイルス抗体価上昇を認め，ＭＲＩでは両側側頭葉病変を認めた。,61,2021-05-16 04:50:54.681000,2021-05-16 04:51:12.798000,0:00:18.117000
